,date,arrondissement,auteur,etoile,education,securite,loisir,sante,transport,qualite de vie,culture,commerce,environnement,commentairePositif,commentaireNegatif
157,Avis posté le 04-11-2014 à 21:17,paris-8e-arrondissement_75108,mjaspard,4.44,5,3,4,5,7,4,5,6,4,"Les points positifs : Beaux bâtiments Haussmaniens comme à peu près partout dans Paris, la gare St Lazare pour rejoindre la mer, de bonnes brasseries et une riche offre commerciale.","Les points négatifs : Aucune vie de quartier, insécurité omniprésente(roms, pickpockets, bagarres au couteau à la sortie des boites de nuit...), ploucs en costard qui font les beaux rue de la Boëtie, bobeaufs qui prennent leur petit arrondissement pour le centre du monde... Circulez, il n'y a rien à voir!"
158,Avis posté le 10-07-2014 à 14:19,paris-8e-arrondissement_75108,Gally,7.00,7,9,1,4,9,8,7,8,3,"Les points positifs : Les transports : beaucoup de stations de métro, vélib, autolib ... 
C'est calme et globalement propre
Monuments historiques à proximité (comme partout à Paris ...)","Les points négatifs : Trop calme dans certains quartiez (rue de Rome c'est mort après 18h30)
Quartier peu dynamique
Les gens pas sympas et peu accueillants ...
Aucun moyen de faire du sport dans le quartier à part des trucs qui sont hors de prix"
159,Avis posté le 23-03-2014 à 14:58,paris-8e-arrondissement_75108,Antoine,6.44,8,8,2,6,9,7,5,3,6,"Les points positifs : Quartier calme, résidentiel, les établissement scolaires sont d'un bon niveau. Belle architecture : quartier qui est épargné de certains projets d'habitation immondes qui dénaturent la capitale.","Les points négatifs : Peu dynamique, le quartier n'est pas jeune. La culture et le sport ne sont pas du tout mis en valeur."
160,Avis posté le 20-02-2022 à 21:14,paris-9e-arrondissement_75109,Ccll09,8.06,8,9,8,9,8,8,9,10,4,"Les points positifs : Quartier bien situé,  proche Paris centre,  Montmartre et des gares,  toute la rive droite accessible à pied en 30 minutes max. Transports en commun nombreux,  commerces et restos très variés et de qualité. Petit arrondissement avec quatre quartiers aux ambiances très différentes. Architecture magnifique,  avec notamment la nouvelle Athènes.",Les points négatifs : Prix de l'immobilier indécents. Manque d'espaces verts.
161,Avis posté le 07-01-2022 à 14:16,paris-9e-arrondissement_75109,Max du 9,8.13,10,7,7,8,10,8,9,10,5,"Les points positifs : Beaucoup de commerces,  de magasins,  restaurants,  bars,  Musée,  animation,  salle de spectacle.
C'est un quartier vivant de jour comme de nuit.
Des animations de quartiers régulièrement pour tout âge.
Beaucoup d'accès avec les transports en commun. ","Les points négatifs : Très peu de parcs. 
Peut être bruyant la nuit selon les endroits."
162,Avis posté le 18-11-2021 à 09:40,paris-9e-arrondissement_75109,Tom,3.88,6,3,1,6,6,3,8,7,1,"Les points positifs : - Les nombreuses stations de métro aux alentours (mais qu'est-ce que c'est sale et mal fréquenté !)
- La patrimoine et les bâtiments
- L'accès à la culture.","Les points négatifs : - Beaucoup de mégots,  crachats,  masques,  détritus (qu'attend la police et la municipalité pour verbaliser !),  et encore plus à proximité des fast-food)
- De plus en plus de banlieusards qui traînent et des personnes implantées dans des logements sociaux qui n'ont pas nos codes (sur l'hygiène,  la laïcité),  et qui participent à fortement renforcer notre sentiment d'insécurité et qui dégradent tout ce qu'ils foulent
- La pollution atmosphérique et les nuisances sonores provoquées par les voitures / motos and co.
- Le peu d'espaces verts (souvent mal entretenus -> le square Estienne d'Orves en est un exemple). Les jours de canicule,  il est impossible de vivre dans ce quartier autant bitumé."
163,Avis posté le 30-10-2021 à 06:50,paris-9e-arrondissement_75109,Sam,4.94,4,0,4,8,7,5,7,9,0,"Les points positifs : Quartier au demeurant sympathique, des cafés sympas. Des marchés au top. Très beau quartier. Animé,  beaucoup d'espaces verts,  très bien desservi en transport en commun.","Les points négatifs : Insécurité totale dans certains endroits. Police inexistante. Les week-end une véritable poubelle,  une mairie qui se moque totalement des ses administrés. Beaucoup d'initiative pour l'écologie mais aucune pour la sécurité qui dans certaine rue du 9ème est un véritable problème. Bagarre générale quasiment tous les jours, à l'heure qu'il est un homme est entrain de se faire taper dessus par 15 hommes."
164,Avis posté le 23-09-2021 à 09:02,paris-9e-arrondissement_75109,Tracks,8.50,8,9,9,9,7,9,8,9,5,"Les points positifs : Franchement un super arrondissement bien desservi en transport, l'ambiance village, une offre culturelle abondante.","Les points négatifs : Il y a bien sur le manque d'espace vert à proximité,  les embouteillages notamment rue Lafayette et de plus en plus l'insécurité mais c'est bien moins pire comparé aux arrondissements autour comme le 10ème qui est une poubelle et un crackland,  le 18 ème n'en parlons pas et même le 8 ème et Paris centre envahi par les banlieusards,  comparé à ces quartiers le 9ème est presque un îlot de sécurité."
165,Avis posté le 09-09-2021 à 23:06,paris-9e-arrondissement_75109,Hpm,2.00,5,5,5,5,5,0,5,2,0,"Les points positifs : Transport,  le quartier est bien desservi.","Les points négatifs : Le bruit,  la police qui ne fait rien au détriment des riverains. Pire quartier dans lequel j'ai pu vivre à Paris. Travaux toute les nuits et le dimanche,  camions poubelle dés 6h du matin... Peu de commerces de bouche.
Ok pour visiter et shopping mais surtout ne pas y vivre."
166,Avis posté le 12-03-2021 à 15:39,paris-9e-arrondissement_75109,panam,8.81,7,5,7,9,9,10,9,10,5,"Les points positifs : quartier très agréable à vivre,  très bien situé et de plus en plus calme au niveau de la circulation. gros coup de coeur pour la rue des martyrs pleine de charme et de commerces délicieux","Les points négatifs : police trop souvent absente,  parc et jardins encore trop petits pour un quartier qui se développe de plus en plus vers la qualité de vie."
167,Avis posté le 09-09-2020 à 10:13,paris-9e-arrondissement_75109,Dakota 63,8.75,8,7,7,10,10,9,9,9,8,"Les points positifs : Emplacement exceptionnel tout est à quelques pas : transports, métros, rer, bus à foison pour se déplacer dans toutes les directions, bars, restaurants, théâtres, Olympia tout à pieds, opéra Montmartre, grands magasins, enfin tout. Le vrai Paris plein de charme.","Les points négatifs : Quelques nuisances sonores dans certaines rues.
La sécurité à renforcer dans certains endroits."
168,Avis posté le 30-07-2020 à 13:05,paris-9e-arrondissement_75109,Granit,7.19,10,9,8,9,9,6,10,10,2,"Les points positifs : - quartier très joli et vivant, typiquement parisien
- nombreux théâtres
- beaucoup de commerces de toutes sortes
- beaucoup de restaurants de qualité (du choix pour les vegans)
- sentiment de sécurité
- transports performants, arrondissement traversé par de nombreuses lignes de métro
- idéalement situé entre Opéra et Pigalle, et entre Gare St Lazare et Gare du Nord, tout est « proche » d'un coup de vélo (J'ai même pris l'habitude de tout faire à pied depuis que je vis dans le 9ème).","Les points négatifs : - quartier horriblement bourgeois
- prix de l'immobilier
- prix des commerces : supermarchés, fromageries, opticiens, friperies... tout est plus cher.
- pas de mixité sociale (Le royaume des bobos blancs)"
169,Avis posté le 05-05-2020 à 15:09,paris-9e-arrondissement_75109,Callie,8.38,8,6,8,7,9,9,9,9,6,"Les points positifs : Arrondissement agréable, de nombreux commerces à proximité et très bien aussi niveau transports.","Les points négatifs : La propreté laisse parfois à désirer, pas assez de maraude pour les sans abris. Souvent des jeunes traînent sur mon rebord de fenêtre (rdc) et fument des choses plus ou moins légales, pas de rondes de policiers."
170,Avis posté le 16-04-2020 à 00:46,paris-9e-arrondissement_75109,Mareck,2.44,0,4,0,7,7,1,5,5,3,"Les points positifs : Le peu de fréquentation dans les commerces d'alimentation permet de faire rapidement ses courses.
Le quartier est très ""vivant"", entre les fan de pharmacie opaques,  les bobos, les SDF et les touristes ainsi que les fêtards, si vous aimez les grosses ""ambiances"", vous allez être servis.

Franchement, je trouve les parisiens normaux voire même sympathique, étant issue de la banlieue et des Antilles, je ne comprend pas cette réputation qui leur est attribué à tort par les touristes, provinciaux, et la périphérie dans sa globalité.","Les points négatifs : Le bruit / le chahut....
Les bars avec les consommateurs indiscrets.
Les bohèmes qui refont le monde autour d'un café ou d'un bon verre de vin.
Les deux roues qui arborent les rue avec le doux bruit de leurs pots d'échappements.
Même avec le confinement, le bruit est insupportable, c'est extraordinaire.
Les chiens qui disséminent leurs œuvres éphémères sur les trottoirs et qui improvisent des performances artistiques sonores très agréables à entendre avec les rues qui amplifient les décibels, mais quel joie intense, vraiment!

A moins d'être un enfant d'oligarque et de pouvoir vivre au 4 ème / au 5 ème dans un 120m2 (avec un parc à proximité) ou alors être un passionné d'histoire et de littérature voire de culture, je ne comprends pas l'avantage de vivre dans Paris intra-muros en terme de qualité de vie.
A la base, c'est une sérendipité qui a contribué a cette venue, et bien le hasard fait mal les choses..."
171,Avis posté le 23-02-2020 à 12:01,paris-9e-arrondissement_75109,Vicc,8.94,6,9,4,9,8,10,9,9,9,"Les points positifs : Vie de quartier géniale, commerces, bars, opéra, centre de Paris à proximité, galeries La Fayette, aucun problème de sécurité, beaucoup d'infrastructures de santé, pas trop de circulation.","Les points négatifs : Centres sportifs souvent en grève, établissements scolaires corrects mais rien d'excellent, pas assez d'espaces verts."
172,Avis posté le 20-10-2019 à 06:12,paris-9e-arrondissement_75109,MParis9,9.13,10,8,9,9,10,9,10,10,8,"Les points positifs : Vie de quartier fantastique, commerces, théâtres, le vrai Paris. Beaucoup de restaurants. Sopi, Nouvelle Athènes, Opéra, Montmartre juste à côté, le centre de Paris à deux pas, le top. La vie la nuit, beaucoup de bars, discothèques et lieux mythiques.","Les points négatifs : Manque quelques espaces verts, au nord le tourisme à cause de Montmartre."
173,Avis posté le 25-08-2017 à 09:13,paris-9e-arrondissement_75109,Laurent_du_9e,8.63,9,7,6,9,10,9,10,10,5,"Les points positifs : Opéra Garnier, Olympia, grands magasins, passages couverts, musée Grévin, beaucoup de cinémas et théâtres, arrondissement central, beaucoup de restaurants et bars, très dynamique avec implantation de sièges sociaux de grands groupes et de startup, très belle architecture des bâtiments en général, excellente desserte en transports en commun beaucoup de lignes de métros (2, 3, 7, 8, 9, 12, 13, 14) et RER (A, E) sans compter les nombreuses lignes de bus, mairie très dynamique à l'écoute de ses concitoyens, j'adore mon neuvième.","Les points négatifs : Beaucoup de contraste entre le nord et sud de l'arrondissement.
Manque cruellement d'espaces verts (normal centre de Paris).
Saleté des rues, beaucoup de SDF qui font la manche dans les endroits touristiques de l'arrondissement, incivilités vers Saint-Lazare."
174,Avis posté le 26-06-2017 à 09:17,paris-9e-arrondissement_75109,sophie,9.38,9,8,7,8,10,10,10,10,8,"Les points positifs : Un quartier qui a connu de grands changements en 15 ans. Idéal pour les gens qui recherchent l'animation et la culture. Une vie agréable avec une quantité de commerces, de restaurants, de cinémas, de théâtres, la librairie de Paris place de Clichy, la proximité des parcs Monceau et Clichy-Batignolles. Les grands magasins tout proches... Un quartier vivant (plein d'histoire : tous les peintres et musiciens vivaient là au 19e) et central avec un maximum de commodités.","Les points négatifs : à éviter le terre plein entre Blanche et Pigalle, sale et mal fréquenté le soir et la nuit !"
175,Avis posté le 04-05-2017 à 23:09,paris-9e-arrondissement_75109,sal14dh,6.81,5,4,7,7,9,7,7,8,6,"Les points positifs : Très bien desservi, aucun besoin de voiture. Accès aux gares en 30 minutes max.","Les points négatifs : Cambriolages et agressions dans la rue dans le nord du 9e (vécu)
Certaines rues sont bruyantes la nuit à cause des bars."
176,Avis posté le 02-01-2017 à 11:37,paris-9e-arrondissement_75109,G0ur0u,9.06,10,9,8,9,9,9,10,10,8,"Les points positifs : Très central, adapté aux familles. Culture au top (ciné, théâtres...). Très bonnes écoles.","Les points négatifs : Peu d'espaces verts. Il faut aller dans les arrondissements voisins pour avoir du vert. Lieux de sport nombreux, mais pas de grandes surfaces (foot, tennis..)."
177,Avis posté le 03-10-2016 à 16:47,paris-9e-arrondissement_75109,AMG,8.69,8,8,8,9,9,9,9,10,6,"Les points positifs : Super arrondissement, population agréable et dynamique, des infrastructures en nombre (transport, écoles, piscines, squares...)",Les points négatifs : Une réduction de la vitesse sur les grands axes aiderait à mieux circuler à pied dans l'arrondissement
178,Avis posté le 04-12-2015 à 09:46,paris-9e-arrondissement_75109,Cléclé,7.75,6,5,5,9,10,8,8,10,7,"Les points positifs : - quartier animé mais paisible 
- beaucoup de commerces, très agréable 
- nombreux restaurants 
- au coeur de Paris","Les points négatifs : - quelques squares très mal fréquentés 
- beaucoup de circulation sur la rue la fayette"
179,Avis posté le 21-08-2015 à 11:28,paris-9e-arrondissement_75109,mourkos,8.63,7,6,6,8,10,10,7,10,4,"Les points positifs : arrondissement plein de contraste entre le sud et le nord. Bien desservi par le métro, beaucoup de commerces de proximité. La vie y est animée sans être trop bruyante",Les points négatifs : immobilier très cher et manque d'espaces verts
180,Avis posté le 16-07-2015 à 22:40,paris-9e-arrondissement_75109,Karl,6.13,7,7,5,9,10,5,8,10,2,"Les points positifs : Beaucoup de commerces alimentaires ouverts tard le soir.
Réseau de transports dense : 5 lignes de métro à moins de 10 minutes, idem pour les bus.","Les points négatifs : Rues sales, surtout dans le sud de l'arrondissement.
Trottoirs étroits et encombrés.
Manque d'espace en général, bruyant, pollué."
181,Avis posté le 03-05-2015 à 23:20,paris-9e-arrondissement_75109,Annette,7.31,8,4,5,8,7,8,9,10,2,Les points positifs : Proximité de tous les services et loisirs possibles. Beau cadre de vie. Quartier animé de jour comme de nuit. Un lien entre des environnements très différents comme le marché de Barbes et le boulevard Haussmann.,"Les points négatifs : Tout le temps sollicité dans la rue par des gens dans le besoin. Manque d'espaces de respiration. Difficile de garer une voiture. Prix aux m² trop élevés, population bourgeoise-branchée du cliché parisien."
182,Avis posté le 31-03-2015 à 16:20,paris-9e-arrondissement_75109,Elliottt,6.56,7,7,7,6,10,6,10,9,1,"Les points positifs : Il y a toujours qq chose a faire dans le quartier, notamment martyrs - condorcet - trudaine. Entre les sorties culturelles, les bars restaurants. Une vraie vie de quartier","Les points négatifs : Espaces verts, ambiance Snob qui tend à se développer avec le prix du m2"
183,Avis posté le 31-01-2015 à 12:20,paris-9e-arrondissement_75109,Claude,4.69,5,0,0,0,10,5,10,5,5,"Les points positifs : La culture, la bibliothèque et internet pour communiquer avec le monde extèrieur mais pas avec les administrations qui ne répondent jamais.","Les points négatifs : Toujours pas de logement,d'emploi... pour les petites gens, parisiens nés à Paris.
Tout est bien cadenassé par les administrations pour ne pas vivre à Paris, pour ne pas revenir dans la ville après avoir été chassé par l'immobilier..., pour ne pas accéder aux droits fondamentaux...
Un système qui exclu les personnes désavantagées de la ville de Paris, ou ce sont toujours les plus forts qui ont droit à tout..."
184,Avis posté le 26-11-2014 à 00:04,paris-9e-arrondissement_75109,marc,7.94,9,6,6,8,10,8,9,9,6,"Les points positifs : quartier très diversifié et assez central
Transports en Commun très denses et pratiques
un quartier attachant","Les points négatifs : boboisation de tous les secteurs : immobilier de plus en plus cher
comme partout à Paris manque d'espaces verts"
185,Avis posté le 06-11-2014 à 13:31,paris-9e-arrondissement_75109,Georges St,9.38,8,9,8,9,9,10,10,10,7,"Les points positifs : Calme mais vivant avec ses nombreux petits restaurants, de nombreux commerces par exemple rue des Martyrs, l'architecture du début du XIXeme (quartier de la nouvelle athène)","Les points négatifs : Manque d'espaces verts, très peu de parcs."
186,Avis posté le 20-09-2014 à 23:30,paris-9e-arrondissement_75109,MMI,8.44,8,7,6,8,9,9,8,9,8,"Les points positifs : Musée, Opéra, cinémas, transports, commerces, qualité de l'immobilier, sécurité...
Il y a également beaucoup de commerces ouverts le soir sans parler des restaurants également ouverts...
Une proximité immédiate également avec le 1er et 8ème arrondissement et le fait que le quartier soit centrale permettent de trouver son bonheur sans avoir à utiliser les transports en communs.
Une maire active ! 
Quartier très très agréable entre les places de l'Opéra et de la Madeleine.
Il y a beaucoup d'hôtels particuliers et musée à découvrir.","Les points négatifs : Les bars sur les grands boulevards entre Bonne Nouvelle et Richelieu Drouot du mercredi soir au dimanche rendent le passage des piétons difficiles compte tenu de la foule.
Le quartier est de plus en plus onéreux."
187,Avis posté le 09-09-2014 à 15:09,paris-9e-arrondissement_75109,kiwi,8.88,8,9,8,9,10,9,9,9,8,Les points positifs : Tous à proximité et il fait bon vivre. Il existe une proximité entre commerçants et habitants. Très agréable,Les points négatifs : qualité de l'air (PARIS) et quartier très cher !!! pas aménagé pour les personnes handicapés
188,Avis posté le 14-06-2014 à 11:55,paris-9e-arrondissement_75109,Claude,5.25,5,5,5,6,6,5,6,6,5,"Les points positifs : Arrondissement ni meilleur ni mauvais, normal.","Les points négatifs : Ne permet pas le retour à la personne qui est née et qui a grandi dans le 9ème arrondissement de Paris, chassé par l'abus des prix de l'immobilier dans les années 70, de nouveaux occupants ont pris le territoire... Mairie du 9ème érigée en Chateau impénétrable pour les petites gens."
189,Avis posté le 17-02-2014 à 22:00,paris-9e-arrondissement_75109,parisian,9.44,9,10,9,7,9,10,10,9,8,"Les points positifs : Clairement c'est l'un des quartiers parisiens pour moi des plus tranquile, où règne une qualité de vie presque provinciale. Peu de touristes (en dehors des Grands Magasins). Tout le monde se connait, et se voit avec beaucoup de convivialité. Le quartier se boboise mais ce n'est aucunement un mal. La sécurité encadre l'ensemble du quartier qui est même fermé à la circulation automobile à certaines heures (voir quartiers Martyrs)",Les points négatifs : Le Manque d'espace vert assez flagrant.
190,Avis posté le 15-01-2022 à 14:13,paris-10e-arrondissement_75110,Villon,8.13,9,6,8,8,9,8,8,10,8,"Les points positifs : Très bien desservi par les transports,  mix de quartiers populaires et plus bourgeois,  tous les commerces y sont représentés,  il y a une foule de bars et de restaurants,  la présence de deux gares majeures.","Les points négatifs : Propreté,  manque d'espaces verts mais les buttes Chaumont sont à un jet de pierre
les scooters y prolifèrent mais c'est une peste qui infeste tous les arrondissements."
191,Avis posté le 26-12-2021 à 12:10,paris-10e-arrondissement_75110,Pierre54,9.50,9,8,9,10,10,10,9,9,8,"Les points positifs : Un arrondissement dans lequel je vis depuis ma naissance et que j'aime.
Central,  bien desservi,  multiculturel,  avec trois hôpitaux et deux gares,  je ne me verrai pas vivre ailleurs.
La municipalité est active pour faire avancer les choses. Que du positif.",Les points négatifs : Rien de négatif à dire. C'est l'arrondissement de mes rêves.
192,Avis posté le 20-12-2021 à 22:31,paris-10e-arrondissement_75110,Xgb,8.25,9,9,9,9,10,8,9,9,4,"Les points positifs : - plein de vie culturelle et de vie locale,  marchés,  bars,  restau
- reste un arrondissement avec de la diversité
- très bien desservi
- en 10 ans je ne me suis jamais senti en insécurité
- le canal St Martin est hyper agréable
- bonnes écoles","Les points négatifs : - grosse différence entre le canal Bobo et le quartier gare du nord très sale
- forte densité avec peu d'espaces verts en dehors du canal et du square Villemin."
193,Avis posté le 04-12-2021 à 22:26,paris-10e-arrondissement_75110,Plebuse,7.94,10,7,9,9,10,7,10,10,6,"Les points positifs : Quartier cosmopolite,  central,  très commercial,  plein de bars et de restos,  donc très passant... Des qualités qui viennent avec les défauts afférents (du monde dans les rues,  du bruit,  des sirènes). Je ne m'y suis jamais senti en insécurité. Parmi les meilleures écoles de Paris (1er lycée de France: Bossuet notre dame). Hyper bien desservi. Le canal est super sympa,  j'y cours toutes les semaines jusqu'à Pantin.
Si vous aimez un quartier pépère ce n'est pas pour vous. Si vous aimez la vie,  c'est un excellent quartier.",Les points négatifs : Du bruit mais quand les 2 roues motorisés seront interdits ça ira mieux. Trop de camions sur le boulevard de Magenta. Trop de gens qui urinent dans les rues. on aimerait bien moins de trafic de clopes et de légumes.
194,Avis posté le 03-11-2021 à 21:10,paris-10e-arrondissement_75110,Marie,1.75,5,0,4,4,7,0,4,4,0,"Les points positifs : Gare du Nord:
Le RER B: pratique pour rejoindre CDG ou Orly via Anthony.
L'Eurostar pour rejoindre Londres.","Les points négatifs : Arrondissement très dangereux et sale.
Pas de parc ou de square safe pour les enfants. C'est le quartier des toxicomanes et des délinquants. A la sortie de la gare du nord les touristes ont envie de repartir chez eux..."
195,Avis posté le 24-08-2021 à 15:47,paris-10e-arrondissement_75110,Domingo75,3.50,5,2,2,4,4,3,5,8,2,"Les points positifs : - Nombreux restaurants,  cafés sympa
- Beaucoup de choix de commerce bio (La Vie Claire etc.)
- Médiathèque Françoise Sagan qui apporte un vrai plus dans le quartier
- Accès aux quais de Seine et au centre de Paris en 20-25 minutes à pied.","Les points négatifs : - Quasi aucun espace vert digne de ce nom,  le moindre square est envahi par les drogués/migrants (coucou le square de l'église Saint Vincent). Irrespirable en été.
- Logements sociaux et faune qui va avec notamment vers la rue Lafayette : hurlement le soir,  blocage de la rue pour des foots improvisés à 23h,  deal.
- Rue sales et qui puent la pisse.
- Terrasses ""éphémères"" en palettes de bois qui donnent au quartier des airs de ZAD et qui font le bonheur des crackés.
- Proximité avec la gare du Nord et de l'est qui apporte son lot de racailles et de parasites
- Boites aux lettre de mon immeubles forcées,  vol de vélo dans la cour,  insultes dans la rue.

Le 10ème est en passe d'emboiter le pas au 18ème au niveau de l'insécurité,  de la crasse et du manque de savoir-vivre. Actuellement j'ai le sentiment de vivre dans un Bagdad à 11000 euros du M2.
PS : Quand on importe le tiers-monde,  on devient le tiers-monde !"
