,date,arrondissement,auteur,etoile,education,securite,loisir,sante,transport,qualite de vie,culture,commerce,environnement,commentairePositif,commentaireNegatif
392,Avis posté le 13-07-2018 à 22:41,paris-16e-arrondissement_75116,Franco-indienne,3.31,9,4,6,6,3,1,10,4,3,"Les points positifs : Le quartier de Passy est très calme, on se sent en sécurité dans la journée, pas vraiment de harcèlement sexiste. Magnifique architecture, plusieurs musées, commerces et marché : tout cela pourait être idéal pour y vivre.","Les points négatifs : Sans compter le prix élevé des produits, les trottoirs puants, couverts de crottes de chiens que leurs maîtres ne ramassent pas souvent, le vrai souci pour moi c'est la xénophobie exécrable des résidents et même des commerçants. Il faut avoir la bonne ""tête"" - franco-française, du moins de la race blanche, avec la tenue et les accessoires de grandes marques. Autrement, c'est le harcèlement raciste au quotidien : commentaires en haute voix, regard hostile, bousculade exprès, scène scandaleuse en public, alerte à la vigile dans les commerces (évidemment tous les gens de couleur sont soit terroristes, soit voleurs, sinon les deux, sic !) : C'est juste hallucinant. Tout cela de la part des hommes, femmes, jeunes, moins jeunes, adolescents. Avant de vivre ici (depuis 4 ans) je ne savais pas qu'il existait des Parisiens capables d'une telle bassesse, telle mesquinerie."
393,Avis posté le 12-05-2018 à 03:34,paris-16e-arrondissement_75116,Alp16,7.44,9,8,6,9,9,7,6,9,7,"Les points positifs : 18 ans que j'habite le 16e arrondissement (quartier Passy-Muette puis Victor Hugo).
Les points positifs : 
- Commerces :bouche, textile, etc...
- Ecoles 
- il fait bon vivre, calme, sauf... voir ponts négatifs.
- Transports en commun : bus 22 et 52 qui vont au ""centre"" de Paris.
- Ligne 2,6 et 9 qui vous amène à l'autre bout de Paris en 30/40 minutes.
- Médecin généraliste ou spécialiste, c'est pas ça qui manque voir aussi points négatifs.","Les points négatifs : - 3/4 des habitant sont mal éduqués, raciste, hautin, parfois même dans le méprisable surtout si vous n'avez pas la ""tête"" du quartier ou un sac pour les femmes à plus de 5.000 euros et pour les hommes un petit polo à cheval ou une montre à 10.000 euros.
- Commerçant surtout dans les boulangeries qui pratique la discrimination à la ""tête"" vous n'avez pas la ""tête"" du quartier on vous répondra froidement (et encore!) par contre la dame au sac très connu, aura toute la sympathie!
- Prix de l'immobilier que je trouve non justifié 
- Ado vraiment mal élevé 
- Certains coins à éviter tard le soir ou très tard comme av Foch en week-end surtout pour une femme seule (le duplex à proximité...plus délinquance qui traîne) pte Dauphine (prostitution et trafic de stup donc délinquance), Trocadéro tard le soir mais cela est une évidence, pte de St Cloud également 
- L'avenue Foch qui devient une piste de GP! c'est de pire en pire!
- Moto et scooters qui prennent les trottoirs pour des pistes de GP 
- Prix des magasins de bouche ainsi que les médecins spécialistes ou non 
- Terrasses de bar et de restaurant rue de la Pompe qui ne respectent pas la réglementation, vous êtes obligé de marcher en crabe!"
394,Avis posté le 11-03-2018 à 18:40,paris-16e-arrondissement_75116,Parisien,5.94,8,9,5,5,8,5,4,6,10,"Les points positifs : La place Victor Hugo est géniale, avec plein de restaurants/cafés, et l'Arc de Triomphe à 10 minutes ! Le coin Passy est agréable et il y a beaucoup moins de touristes qu'au Trocadéro, toujours bondé.","Les points négatifs : Bien desservi mais des stations de RER -C- inutiles, et insalubres. 
Avenue du Pont Kennedy par exemple.
Les gens sont très hautains par ici, et le quartier n'est pas vivant de par le manque de commerces à certains endroits."
395,Avis posté le 20-12-2017 à 13:55,paris-16e-arrondissement_75116,Alix75,8.50,8,8,7,8,7,9,8,9,9,Les points positifs : Quartier Passy-la Muette très agréable dans son ensemble.,"Les points négatifs : Commerces trop chers par rapport à la moyenne et en manque de certains (bricolage par exemple) aux dépends d'une multitude de magasins vestimentaires, de plus ou moins bon goût.
Clochards îvres qui traînent le journée et parfois les soirs tardivement, bruyants et empêchant de se sentir à l'aise dans certains endroits publics."
396,Avis posté le 23-11-2017 à 16:21,paris-16e-arrondissement_75116,AntoineAuteuil,7.19,8,6,8,8,8,7,8,4,9,"Les points positifs : Très bel arrondissement propre et calme, beaucoup d'espaces verts. Architecture remarquable, beaucoup d'édifices Art Nouveau (H.Guimard) par exemple. Quartier entre Auteuil et Passy très sympa.
Contrairement aux clichés, les loyers sont plutot abordables.","Les points négatifs : Vraiment trop calme, manque cruel de bars ou restaurants modernes et branchés, un peu excentré (compter 30 min pour rallier le centre). Les bords de Seine ne sont pas aménagés pour les piétons."
397,Avis posté le 19-11-2017 à 01:17,paris-16e-arrondissement_75116,PaulLavest,9.13,10,10,10,10,8,9,9,9,8,"Les points positifs : Excellent enseignement (Janson, Franklin, St Jean de Passy...). Très bonne qualité de vie en famille par rapport aux autres arrondissements de Paris. Beaucoup de musées : Guimet, Palais de Tokyo...
Proximité du bois de boulogne, tranquillité et sécurité. 
Très bons commerces et beaucoup de restaurants.
Pas trop de touristes.",Les points négatifs : Quelques quartiers à éviter le soir notamment les jardins du trocadéro.
398,Avis posté le 24-08-2017 à 17:54,paris-16e-arrondissement_75116,cassandre,9.44,10,8,8,10,8,10,8,10,9,"Les points positifs : Arrondissement paisible et familial, préservé de tous les inconvénients de l'hyper-centre.
-Qualité de vie exceptionnelle de l'Etoile à la rue d'Auteuil, en passant par la Muette, joyau du 16eme: commerces en abondance, restaurants tradi ou luxueux, bars de quartier, terrasses... Ouverture prochaine de la Grande Epicerie rue de Passy (homologue du Bon Marché dans le 7e), signe du dynamisme du quartier. Excellents lycées. Bonnes infrastructures sportives, pour répondre à la jeunesse fortement présente.
Les prix sont identiques à l'hyper-centre. Peu de touristes, légère animation sans excès fort appréciable. 
-Beaucoup de végétation, voies ombragées, et de nombreux sites immédiatement accessibles comme les lacs du bois de Boulogne, Bagatelle, la grande cascade, les serres, les quais de Seine, etc. Bon réseau de vélib. Esthétisme des rues impeccable.
-Pour le reste, propreté/délinquance: ça reste Paris. Aucun lieu n'est sûr à 100%.

5 ans que j'y vis modestement, aucune raison ne me pousserait à déménager.","Les points négatifs : -Problème de communication de l'arrondissement avec le reste de Paris, hostilités de l'Hôtel de Ville souvent prises pour des provocations.
-Image ternie par une minorités d'individus entretenant les clichés.
-Le quartier Porte de St Cloud me paraît excentré, et trop animé les soirs de match. Peut se révéler intéressant si offre immobilière imbattable."
399,Avis posté le 07-08-2017 à 12:59,paris-16e-arrondissement_75116,Roger,7.94,10,10,7,7,9,8,7,3,10,"Les points positifs : Des immeubles magnifiques, des parcs et jardins vraiment sympa , on est préservé de la grosse pollution des grands boulevards. Calme et propreté. Le jardin du Ranelagh très agréable.","Les points négatifs : On se sent à l'écart du reste de Paris et franchement le soir pas un chat dans les rues, le calme plat, ça manque de vie. Peu de commerces de proximité sur certains secteurs : Boulevard Marechaux, Suchet, Marechal-Maunoury."
400,Avis posté le 16-02-2022 à 21:05,paris-17e-arrondissement_75117,Mercurio,6.81,7,5,8,8,8,7,6,7,4,"Les points positifs : Note pour la porte de Clichy.

Le quartier a bien changé depuis la phase terminale des travaux : très bien desservi avec le métro le tramway le RER et donc la ligne 14 qui permet de gagner le centre de Paris en 10 mn.  A noter toutefois depuis son extension une augmentation des pannes de cette ligne auparavant très fiable.

Beaucoup de diversité notamment avec le parc Martin Luther King où la proportion de logements sociaux est idéale pour que se croisent les classes et les origines dans ce parc qui n'est pas le plus beau de Paris mais le plus fonctionnel. Possibilité de poursuivre la marche ou le running vers le square des Batignolles quasi contigu si on veut du beau.

Le Palais de justice amène aussi naturellement une fréquentation en journée de professionnels du droit qui a dynamisé l'économie du quartier.

Circulation moins problématique depuis la fin des travaux et la mise en sens unique de l'avenue de Clichy (moins d'automobilistes sortent de Paris par là). Auparavant c'était concert de klaxons quotidiens aux heures de pointe.

Des petits commerces et alimentaires pas trop chers et de bonne qualité standard : Intermarché,  ou Lidl à 10 mn à pied ou 2 mn en tram,   pressing,   boulangeries,   petit centre commercial à 5 mn de marche rue Cardinet. Pour les restaurants il faut aussi marcher 5-10 mn vers Brochant ou alors dans la nouvelle rue Mstislav Rostropovitch,   encore un peu déserte toutefois.

Piscine rénovée rue de la Jonquière à 5 mn,   bloc d'escalade rue Mstislav.

Ce quartier n'est pas très beau ni très intéressant,  mais son avantage est qu'on peut en sortir et rayonner dans tout Paris facilement et rapidement.","Les points négatifs : L'augmentation des transports en commun a provoqué une arrivée progressive de la pauvreté qui peut être pesante au quotidien pour qui s'en soucie : des sans domicile fixe sur les bouches d'aération ou déambulant tant bien que mal,   vendeurs de fruits et légumes,  vendeurs de cigarettes au métro ligne 14. C'est tout de même d'une intensité moindre que celle de certains quartiers de l'est Parisien.

Côté nuisances ,  les sirènes omniprésentes des pompiers et policiers utilisées de manière intempestive sans égard pour les riverains,  les livreurs des nombreux restaurants de fastfood.

La nuit, le quartier est calme,  peu de bars ,   peu de deal ou de prostitution voyante comme cela pouvait être le cas il y 4 ou 5 ans.

La petite délinquance est endémique comme dans tout Paris et des vols ou agressions sont possibles mais la présence policière du fait de la proximité du Palais et de la PJ est relativement dissuasive.

Quartier un peu plus sale que la moyenne à Paris même si pas le pire.

A part quelques boîtes à livres,  le quartier propose peu d'activités culturelles (musées,   salles de spectacle,   théâtres,  librairies) à part le cinéma les 7 Batignolles et le théâtre des ateliers Berthier qui est la seconde salle de l'Odéon.

Enfin la pollution de l'air est toujours préoccupante du fait du trafic avenue de Clichy plus blvd des Maréchaux."
401,Avis posté le 08-01-2022 à 12:34,paris-17e-arrondissement_75117,Personne,6.44,4,3,7,5,8,7,6,8,6,"Les points positifs : Transport de proximité,  pas mal d'espaces verts avec le parc Martin Luther King et le boulevard Pereire, so ouest à proximité
Beaux immeubles dans quelques endroits
proximité avec le 8eme arrondissement
coins des Batignolles très sympas.","Les points négatifs : Quand on se rapproche du périf la sécurité se dégrade et ces coins là sont très mal fréquentés
bel arrondissement que quand on est près du 8eme et du 16è et c'est dommage
L'immobilier cher pour rien
Pas grand chose à faire dans le 17eme même
Aucune propreté."
402,Avis posté le 18-12-2021 à 20:44,paris-17e-arrondissement_75117,Shaan,9.06,9,9,10,10,8,9,10,10,7,"Les points positifs : J'ai eu la chance de vivre quelques mois à Paris 17 grâce au Crous,  je n'ai jamais eu aucun soucis,  arrondissement très paisible,  beaucoup de commerces.

Les transports en commun sont très accessibles et peuvent vous emmener là ou bon vous semble.","Les points négatifs : La nuit,  le bruit peut être parfois dérangeant dû aux soirées nocturnes et les transports souvent bondés."
403,Avis posté le 05-08-2021 à 16:55,paris-17e-arrondissement_75117,JFiss17,7.75,8,6,7,9,9,8,6,9,6,"Les points positifs : Superbe architecture
Offre de transports en communs excellents,  surtout grace à l'arrivée de la ligne 14.
De très beaux parcs (le Parc Monceau à lui tout seul vaut la peine)
Bars et restaurants en tous genres
Commerces en tous genres
Proximité avec plusieurs gares.","Les points négatifs : Forte concentration de travaux,  de rénovations,  et de constructions qui ont un impact indéniable sur la propreté et la circulation.
Pollution sonore le jour.
Niveau sécurité,  Paris 17 s'en sort encore pas mal comparé au reste de la ville,  mais certains coins des Batignolles et d'Epinettes commencent à devenir craignos la nuit
Prix de l'immobilier : après,  c'est un problème typiquement Parisien."
404,Avis posté le 23-05-2021 à 16:25,paris-17e-arrondissement_75117,Marre,5.69,7,4,6,8,8,5,6,7,5,"Les points positifs : Tout à proximité,  bien desservi,  de bons lycées et collèges privés permettant d'éviter certains publics.","Les points négatifs : La sécurité se dégrade,  altercations permanentes,  fort trafic (automobile et de drogue),  déchets dans la rue.
Une mairie centrale qui délaisse les arrondissements périphériques transforme progressivement le 17ème,  notamment la Porte de Champerret,  en ghetto.
Des bandes de jeunes mineurs font la loi dans certains coins.

Les voitures de s'arrêtent pas aux feux …

Si mon métier pouvait être exercé hors de Paris ou si j'avais les moyens d'aller d'en un arrondissement du centre,  je serais parti depuis longtemps !!!

D'une rue à l'autre l'ambiance change radicalement,  baladez vous le soir dans le quartier que vous ciblez au risque d'avoir une mauvaise surprise."
405,Avis posté le 05-01-2021 à 16:31,paris-17e-arrondissement_75117,Summer,6.31,7,5,6,7,9,6,6,7,6,"Les points positifs : Il y a beaucoup d'écoles, de parcs, de restaurants, de médecins dans le quartier et les commerces sont variés. A porte de Clichy il y a plusieurs transports en commun : la ligne 13, le RER C, le tram, le bus et bientôt la ligne 14 ce qui permet de se déplacer facilement dans Paris. Le quartier dispose d'un cinéma ce qui est idéal quand on souhaite sortir près de chez soi.","Les points négatifs : Paris est une ville sale. Il y a beaucoup de bruit et la police ne se déplace pas pour le tapage nocturne. Le métro est très sale et rempli de SDF. Tu passes ta vie dans les transports en moyenne une heure pour aller travailler.

Les Parisiens ne sont pas des plus accueillants (heureusement ils ne sont pas tous comme ça), ils ne pensent qu'à gagner un bon solaire et ils n'apprécient guère ceux qui viennent de province.

Supermarchés et boulangeries plus chers qu'ailleurs. Loyer excessif, impossibilité d'acheter à Paris.

Paris n'est pas idéal lorsque l'on a des enfants ou que l'on souhaite en avoir. La ville est très polluée. Après seulement 4 ans et demie de vie sur Paris je me suis retrouvé à souffrir d'asthme dû à la pollution.

Cela fait 8 ans que j'habite Paris mais dès que je peux je quitte Paris et l'Île de France."
406,Avis posté le 29-12-2020 à 18:08,paris-17e-arrondissement_75117,Jimjim,5.31,6,4,6,6,7,5,6,6,4,"Les points positifs : Transport aisé, commerces de proximité chers mais fréquents. Bonnes infrastructures sportives et culturelles.","Les points négatifs : Pollution sonore constante due tant aux voisinage qu'à la circulation, police incompétente, qualité de vie qui se dégrade.
Médecins facturent 100e le quart d'heure.
Pollution de tous les instants."
407,Avis posté le 13-07-2020 à 16:39,paris-17e-arrondissement_75117,rouelan,8.69,9,10,9,9,8,9,7,10,5,"Les points positifs : Attention arrondissement très hétérogène. Note pour Monceau.
Commerces nombreux et plusieurs marchés.
Beaucoup de verdure (parcs et coulée verte).
Sentiment de sécurité (bien habité).
Quartier en mouvement avec le développement de pont Cardinet et la gentrification de Batignolles.
Pas trop de culture sur place mais Opéra et Champs-Élysées à 2 pas.","Les points négatifs : Traversé par des grosses artères bruyantes. Accès à porte d'Asnières souvent bouché avec des bouchons qui s'étendent bien avant.
Pas plus propre que les autres quartiers.
Depuis le déménagement de la PJ et de la justice, les bruits de sirènes ont encore augmenté sans compter les convois VIP qui passent par place Wagram."
408,Avis posté le 26-06-2020 à 19:40,paris-17e-arrondissement_75117,Cleo,8.06,8,8,9,10,10,8,9,8,3,"Les points positifs : J'habite côté Terne, bel arrondissement, belles architectures, proximité des monuments, tout est accessible et à proximité, très beaux parcs, proximité du Bois de Boulogne, avenue Pereire très agréable pour courir, de nombreux restaurants, bien situé à Paris on peut aller partout à pieds si on aime marcher. Marché Poncelet, cafés agréables pour se poser, prendre son petit déjeuner, très bonnes boulangeries. Navette aéroports à petits prix, métros 1, 2 et 6, RER A. Plus d'angoisses de pannes de galère RER en banlieues. Je pense un des meilleurs arrondissement pour vivre, sentiment agréable d'être privilégié.","Les points négatifs : - Trop de bruits (bars, cafés, voisins) et la police ne se déplace pas pour le tapage nocturne. Prévoir un budget boules quies en cire.
- Pas de côté village.
- Mentalité étriquée, les Parisiens ne sont pas accueillants, ne parlent que de travail. Société de castes, les Parisiens ne se mélangent pas et ne donnent pas envie qu'on se mélange à eux, conformisme bourgeois gentilhomme, bref triste et sans intérêt, risque de solitude si ce n'est pas votre ville et de finir comme un robot consommateur et payeur d'impôts.
- Trop de SDF et de mendicité, rien de dangereux mais c'est chiant à la longue d'être sollicitée à tous les coins de rue c'est du harcèlement.
- Supermarchés et boulangeries plus chères qu'ailleurs.
- Impossible d'envisager de payer un tel loyer toute ma vie que ce soit n'importe où à Paris."
409,Avis posté le 25-05-2020 à 16:19,paris-17e-arrondissement_75117,Niego,5.56,5,4,6,8,6,6,6,5,1,"Les points positifs : - Quartier bien situé à coté de La Défense
- Plutôt bien desservi par les transports en commun.","Les points négatifs : - De plus en plus sale. Très très sale
- Rats partout
- De plus en plus d'incivilités
- Travaux partout et très mal organisés
- Bouchons partout
- Très peu de zones vertes."
410,Avis posté le 08-05-2020 à 00:46,paris-17e-arrondissement_75117,Saio,9.00,10,8,9,9,9,9,10,10,7,"Les points positifs : Arrondissement extrêmement varié : la plaine monceau, Ternes, Pte de Clichy, Batignolles, Brochant...
Énormément de ligne de métro (1,2,3,6...) de bus et rer du fait de grosses stations telles que Pte Maillot, Charles de Gaules, Place de Clichy.
Énormément de commerces, cinéma, restaurants qualitatifs.",Les points négatifs : Disparités en fonction des quartiers.
411,Avis posté le 06-05-2020 à 01:01,paris-17e-arrondissement_75117,Plumye,7.81,9,7,6,9,9,8,6,9,6,"Les points positifs : Épinettes, commerces au top, pareil Batignolles. Cosmopolite de mon côté, avec une amélioration constante. C'est calme, assez sécurisant et le tram prolongé t3b a encore amélioré les transports.","Les points négatifs : Peu de salles de concert, musées etc, c'est plus du quartier pour y vivre, faut s'éloigner pour culturel. Encore quelques rues sales et des nuisances sonores."
412,Avis posté le 29-04-2020 à 14:07,paris-17e-arrondissement_75117,Kevinbgdu17,8.44,9,9,6,10,4,9,8,10,7,"Les points positifs : Habitant dans les Batignolles, je trouve que le quartier est très agréable. De nombreux bons restaurants et commerces sont à notre disposition. De plus, le sécurité est exemplaire ainsi que le nombre de squares et parcs. J'adore !","Les points négatifs : Arrondissement assez déséquilibré. Certains quartiers sont plus sales et d'autres moins bien desservis par les lignes de métros. A mon avis, les quartiers les plus agréables du 17e sont ceux qui s'approchent du 8e."
413,Avis posté le 09-02-2020 à 19:16,paris-17e-arrondissement_75117,bernardino,4.38,5,3,6,7,4,4,5,4,4,Les points positifs : beaucoup de restaurants et commerces de bouche.,"Les points négatifs : Accès catastrophique aux sorties de Paris. Qui a décidé de mettre l'avenue de Clichy en sens interdit !! c'est débile.. L'accès à la porte d'Asnières est calamiteuse. C'est une vraie honte de voir ça. Il arrive qu'on ne puisse pas sortir de Paris en voiture. Rues sales, défoncées. Voitures de police avec deux tons en permanence, on se croirait directement au commissariat. Bande de voyous qui se rapproche de Batignolles de plus en plus, sécurité douteuse."
414,Avis posté le 08-02-2020 à 12:06,paris-17e-arrondissement_75117,Koatiki,7.06,7,7,7,6,7,7,7,9,7,"Les points positifs : Bien desservi par les transports : trains ligne L et ligne C et lignes de métro 2 et 3 et bientôt 14.
Beaucoup de commerces, centre commercial So Ouest.","Les points négatifs : Habitant à la limite du 17e et de Levallois (à l'extérieur du périphérique) je souhaiterais que soit améliorée la connexion des deux côtés du périphérique, que le boulevard de Reims soit moins routier (en connectant la rue Raymond Pitet à la rue de Senlis par exemple), voir carrément en couvrant le périphérique entre la porte de Champerret (rue du Caporal Peugeot) et la porte de Courcelles (rue de Courcelles). La couverture est déjà à moitié réalisée sur le périphérique intérieur !

Adresse email invalide !!"
415,Avis posté le 06-01-2020 à 11:07,paris-17e-arrondissement_75117,Skogkatt,7.69,8,6,8,7,7,8,7,9,7,"Les points positifs : Arrondissement scindé en plusieurs zones : les Ternes / Monceau pour les bourgeois, les batignolles/ épinettes (en cours de gentrification) pour les bobos, et les quartiers craignos vers Saint-ouen/Clichy et Périph'. Cela dépend donc de là où vous vivez ! J'habite le haut des Batignolles et le quartier est très bien, très vivant, beaucoup de petits commerces, une population mélangée, mais qui ne fréquente pas les mêmes enseignes.
La ligne 14 va être prolongée dans le 17e pour cet été.","Les points négatifs : Pas vraiment de points négatifs, à part ceux que l'ont peut reprocher à Paris : manque de verdure, pollution, trop de monde...
Je me considère chanceuse d'habiter ce beau quartier."
416,Avis posté le 30-09-2019 à 08:24,paris-17e-arrondissement_75117,Veneela,9.50,8,8,8,9,10,10,9,10,10,"Les points positifs : Un arrondissement divers et varié, avec beaucoup d'enfants qui lui donne l'air jeune et heureux. Les commerces ont littéralement explosé ces derniers mois/années et c'est très agréable de ne pas devoir se déplacer pour faire du shopping.","Les points négatifs : Un peu dense parfois, on ne peut pas trouver de la place dans les restaurants qui sont assez nombreux."
417,Avis posté le 05-07-2019 à 17:20,paris-17e-arrondissement_75117,Adlp,7.13,8,7,4,6,10,7,9,9,5,"Les points positifs : Les Batignolles : village, commerces, marchés, de nombreux restaurants sympa...
Cinéma, culturel, non loin de Montmartre et du Sacré Cœur, petits squares, parc Monceau et parc martin LK....","Les points négatifs : Beaucoup trop de voitures, petits trottoirs, gros gros manque de rues piétonnes (Paris en général...), Avenue de Saint-Ouen + Avenue de Clichy sales...... bars & commerces à revoir..."
418,Avis posté le 20-03-2019 à 16:11,paris-17e-arrondissement_75117,Eugene,3.75,5,6,5,9,2,3,2,4,3,"Les points positifs : Le square des Batignolles.
L'accès aux soins médicaux.","Les points négatifs : Logements chers pour un arrondissement excentré et mal desservi par les transports en commun.
Rues sales : papiers dans les caniveaux, crottes de chiens sur les trottoirs...
Pas très riche culturellement comparé à de nombreux autres arrondissements de la ville."
419,Avis posté le 05-03-2019 à 13:32,paris-17e-arrondissement_75117,patpatrouille,9.19,10,8,9,9,10,9,10,9,10,"Les points positifs : transports.
arbres.
parcs et jardins et squares magnifiques.
crèches.
De nombreux commerces de grande qualité.
le Maire et les adjoints font beaucoup de travail sur le terrain.
la concertation dans le cadre des Conseils Consultatifs de Quartier.","Les points négatifs : les rats envahissement Paris, il est temps que la Mairie centrale fasse le nécessaire.
Des progrès à faire pour la propreté."
420,Avis posté le 02-12-2018 à 21:38,paris-17e-arrondissement_75117,dido,9.06,10,10,9,7,9,9,10,10,8,"Les points positifs : extrêmement bien desservie, beaucoup de bonnes écoles. A deux pas des lieux historiques.
Plus zone touristique internationale quartier des Ternes. 
Idéal pour les familles.","Les points négatifs : Très difficile de trouver des points négatifs, pas assez de pistes cyclables, pas assez de verdure, de parcs.
beaucoup de voitures.
beaucoup de touristes.

Adresse email invalide !!"
