,date,arrondissement,auteur,etoile,education,securite,loisir,sante,transport,qualite de vie,culture,commerce,environnement,commentairePositif,commentaireNegatif
0,Avis posté le 23-09-2020 à 17:03,paris-1er-arrondissement_75101,Parisiendéçu,4.94,6,3,5,5,9,4,6,7,6,"Les points positifs : - De nombreux commerces et transports, étant dans le centre de Paris, cet arrondissement dispose de très nombreuses connexions vers la banlieue et Paris, les déplacements sont donc raccourcis.

- Le patrimoine architectural (Louvre, Palais-Royal) et également le jardin des Tuileries

- Le sympathique quartier asiatique proche de l'Opéra et ses bons restaurants et épiceries.","Les points négatifs : - ""L'ensauvagement"" absolu du quartier des Halles d'où arrivent toutes les raca****s de banlieue. Le jardin jouxtant les Halles est une honte absolue à ce niveau. Pensée émue également au parc d'attraction estival des Tuileries auquel mes grands-parents m'emmenaient étant tout petit et qui me renvoie à tant de souvenirs agréables. Aujourd'hui il est devenu un lieu totalement ensauvagé, malfamé, bruyant et agressif où même moi, masse de muscles d'1m80, je ne me sens pas en sécurité. Une chose est sûre je n'y amènerai pas mes futurs enfants. Quelle tristesse de voir la destruction intégrale de ce lieu (comme tant d'autres) autrefois si agréable."
1,Avis posté le 18-08-2020 à 19:20,paris-1er-arrondissement_75101,trustinme,6.94,4,4,7,7,10,7,10,9,4,"Les points positifs : Plutôt agréable en allant vers l'Ouest, en partant du Conseil d'Etat.
Petits recoins agréables et cachés qu'il faut connaître.
Il est facile de trouver un bus, un métro, nous menant directement à une destination sans ""escale"", c'est un vrai privilège.
Les monuments historiques sont beaux, nous avons la meilleure vue depuis les quais de Seine du Louvre, le point de jonction idéal entre les deux rives.
A pied, on peut déjà visiter beaucoup de choses.
Le Jardin des Tuileries est le meilleur espace vert du quartier.
Les cafés et restaurants, boutiques de la Rue Saint-Honoré, sont historiques, toujours bien entretenus à l'image de ce que l'on essaye de préserver.
La station Louvre-Rivoli ligne 1 est la plus belle de toutes.
Si vous avez la chance d'y vivre, vous n'aurez besoin d'aller nulle part ailleurs.","Les points négatifs : Même dans ce tout petit arrondissement, les disparités sont flagrantes.
Le côté des Halles est répugnant, les lignes de RER facilitent la venue de ces agressifs primates de la savane banlieusarde impatients de dépenser leurs allocs au H&M du Forum et boutiques de contrefaçons miteuses.
Le commissariat, bien en évidence en face de la Canopée, n'y fait plus rien. C'est dire que ces travaux ont bien servi à améliorer la situation. C'est la station RER qu'il faudrait fermer, vous verrez, j'ai raison.
Les rues sont sales. Les SDFs ne sont pas pris en charge. Toujours aux mêmes endroits s'engouffrant d'alcool de chez l'épicier. Dormant à même le sol en plein passage piéton, ivres morts. Du vomi, de la pisse, des tessons de bouteilles.
Je suis en colère que RIEN ne soit fait dans ce quartier historique et touristique, à part des travaux précipités bruyants et boboïsants.
Je vous préviens, messieurs dames de la Mairie (si vous passez par là, et vous en avez intérêt), si vous persistez dans votre incompétence, ce virus va s'étendre de manière fulgurante qu'il ne l'est déjà.
Cette zone du 1er arrondissement est une déchetterie humaine.
Bien sûr, j'exagère (un peu) pour faire réagir, il y a pire à Barbès, mais voyez que cette nuisance prend de l'ampleur dans tout Paris voire même la France entière. Dommage."
2,Avis posté le 28-10-2019 à 11:14,paris-1er-arrondissement_75101,Rose,3.38,5,3,2,4,8,2,9,7,0,"Les points positifs : Central, vie culturelle abondante, commerces partout.","Les points négatifs : Quartier de passage étant donné la proximité du RER. Les gens viennent au ciné, boire un verre ou acheter des vêtements et s'en vont. Les locaux (y en a peu) ne sont pas du tout sympathiques. Bruit constant matin soir, nuit. Saleté des rues étant donné le passage. Délinquance à maîtriser. Et surtout ce qui marque, c'est la pollution, abondante et intense. Ajoutez y le bruit est c'est la formule parfaite pour devenir dingue."
3,Avis posté le 21-06-2019 à 00:00,paris-1er-arrondissement_75101,Karelm,8.94,8,9,8,8,10,10,8,5,7,"Les points positifs : Les transports sont assez faciles entres le métro et les bus, la sécurité pour ma part est présente.
Quartier agréable.
Accès facile aux établissements de santé et aux structures scolaires et pédagogiques.","Les points négatifs : Problème si vous prenez la voiture, sinon trop peu de commerces.
Assez de pollution."
4,Avis posté le 10-04-2019 à 18:59,paris-1er-arrondissement_75101,driragot,9.00,9,7,9,10,10,9,10,10,7,"Les points positifs : Au centre de tout, et donc tout est accessible. On est aussi accessible des autres ce qui veut dire que les amis ne rechignent pas à s'y déplacer. Imbattable niveau transports, culture et commerces. Et pas si cher que ça pour du Paris intra-muros !",Les points négatifs : Beaucoup d'endroits sales à cause des fêtards. Le sentiment de toujours cotoyer des personnes qui n'habitent pas là.
5,Avis posté le 11-09-2018 à 17:36,paris-1er-arrondissement_75101,Piernic,7.69,7,7,6,8,8,8,7,9,7,"Les points positifs : Qualité de vie en général, transports, commerces, il fait bon vivre dans cet arrondissement. Supprimer airbnb qui est très négatif pour le tissus social local. On regrette aussi l'époque où le commissariat des Halles était ouvert 24H/24 :( .",Les points négatifs : Difficile de pratiquer une activité sportive!
6,Avis posté le 29-08-2018 à 20:40,paris-1er-arrondissement_75101,Clo,8.38,6,8,9,10,10,8,10,10,7,"Les points positifs : On fait tout à pieds: on y trouve tout ce dont on peut avoir besoin au quotidien au delà des commerces, et la proximité avec les autres arrondissements du centre permet d'élargir à prix bas l'offre médicale, sportive, etc, car c'est un tout petit arrondissement après tout. Proximité des théâtres du 2e et du 10e. Ne pas oublier la rénovation des halles avec un grand parc et la proximité des quais de seine, maintenant piétons. Sans oublier les tuileries qui occupent une grande partie de l'arrondissement, et Les Halles qui sont maintenant une aire piétonne unique à Paris, agréable et faisant oublier les voitures. Contrairement à ce qu'on pourrait penser, il est aussi assez facile d'y avoir des enfants car les places en crèche ou en halte garderie y sont plus courantes, et les activités ne manquent pas (activités artistiques... au Louvre, et proximité d'activités dans le 2e arrondissement notamment). Sinon, on rejoint l'ensemble de Paris très rapidement grâce à toutes les lignes de transport.","Les points négatifs : Les prix de l'immobilier bien sûr.
Il faut aimer voir du monde, mais si on a des horaires décalés, on arrive quand même à avoir le quartier pour soi le matin."
7,Avis posté le 16-10-2016 à 22:56,paris-1er-arrondissement_75101,CedFanel,7.13,6,5,7,7,10,7,10,10,3,"Les points positifs : Ultra central, la beauté des quartiers, la vie de quartier des Halles, l'abondance des transports en commun et des commerces, vie culturelle, la vie nocturne et les restaurants.","Les points négatifs : Peu de parcs et d'écoles, l'insécurité des Halles et de Châtelet la nuit, très peu de recyclage mis place, manque de verdure en général, places pour stationner très rares."
8,Avis posté le 21-01-2015 à 22:48,paris-1er-arrondissement_75101,Ere,6.63,5,5,5,5,9,7,8,10,3,"Les points positifs : Central, très pratique
Petits commerces de proximité 
Shopping
Proximité de l'ile de la cité et des ponts de Paris pour balades","Les points négatifs : Travaux des halles
Vols en terrasses
Cout de la vie et prix de l'immobilier"
9,Avis posté le 16-01-2015 à 19:49,paris-1er-arrondissement_75101,Eloli,2.63,7,1,1,4,8,1,7,5,1,Les points positifs : Aucun point positif. Tous les banlieusards viennent squatter ici,"Les points négatifs : Insécurité. Tout à l'heure une femme est venue m'agresser dans un magasin car je regardais trop son mari (soit-disant) : je suis lesbienne. En même temps, faut peut-être pas ramener son mari dans un magasin ou il y a de jeunes et jolies femmes (M.... pour le nom). Les parisiens."
10,Avis posté le 04-06-2014 à 16:24,paris-1er-arrondissement_75101,Driss,8.19,6,8,5,5,10,9,10,10,5,"Les points positifs : Le commentaire laconique et stupide de Ash n'apporte rien à la connaissance de ce magnifique arrondissement central. Encore une qui n'habite pas Paris.
Comme dans beaucoup d'arrondissements parisiens, l'ambiance et l'esprit varie incroyablement d'un secteur à l'autre. En partant de l'est marqué par le boulevard Sébastopol et en remontant progressivement vers l'extrême ouest souligné par la place de la Concorde et la cour des comptes, vous traversez des mondes radicalement différents.
L'est : le quartier de Châtelet-les Halles allant du boulevard Sébastopol jusqu'à la rue du Pont Neuf + les Halles en pleine reconstruction. Si l'endroit ne brille pas par son taux de fréquentation important de racailles de plusieurs banlieues difficiles (après-midi et soirs et surtout le week-end), il brille par la beauté de son architecture : n'hésitez pas à vous perdre dans le dédale de ces belles rues chargées d'histoire dont les noms poétiques ont été conservés. Au sud des Halles rue des Innocents avec sa fontaine renaissance (la seule qui reste à paris), rue de la Ferronnerie où Henri IV a été assassiné, rue de l'Arbre Sec où Molière enfin venait chatouiller les pieds des pendus, les 3 belles rues parallèles rue Sauval/ Rue Vauvilliers (ne manquez pas le restaurant La Poule au Pot)/ Rue des Prouvaires. Au nord des Halles, ne ratez pas la sublime église Sainte-Eustache, les très belles rues du Jour et son magasin Agnès B et non loin d'ici le fameux restaurant Le Pied de Cochon, les très animées rue semi-piétonnes Montmartre et Montorgeuil qui se prolongent jusque dans le 2ème arrondissement.
Au sud de l'arrondissement, le quartier Saint-Germain l'Auxerrois avec une partie de l'île de la Cité à ne pas rater (notamment la sainte Chapelle et la Conciergerie); longez le long des quais pour voir tous ces brocanteurs qui sortent de volets en bois vert cadenassés toutes sortes de livres; plusieurs animaleries le long du quai de la Mégisserie, bien que je ne sois pas fan de voir tous ces animaux enfermés dans des cages et vendus comme des objets. Toujours dans ce quartier ne ratez pas la belle église Saint Germain l'Auxerrois depuis laquelle les catholiques avaient fait sonner le tocsin en 1572 pour ouvrir le massacre de la Saint-Barthélémy.
Le quartier du Palais-Royal (on monte d'un degré dans le luxe). Ce quartier est une pure merveille. Le jardin du Palais Royal bien sûr chargé d'histoire (avec ses fameux résidents comme Cocteur et l'écrivain Colette) et son restaurant le Grand Véfour; la belle galerie Véro Dodat; la Comédie française et sa jolie place; le superbe brunch à ne pas Louper le Claus rue Jean-Jacques Rousseau. Bien sûr inutile de présenter le Louvre.
Enfin le quartier Vendôme, monde du luxe avec ses palaces comme le Meurice, le Ritz (le bar Hemingway est à faire : le chef barman Colin Field élu meilleur barman au monde prépare des cocktails grandioses) situé place Vendôme avec sa belle colonne de la victoire et toutes ces joailleries qui l'entourent comme un écrin; le Mandarin Oriental récemment ouvert (sa somptueuse cour intérieure est un bonheur lors des beaux jours). Ne ratez pas le meilleur tea room de Paris ANgélina rue de Rivoli (le chocolat chaud y est tout est aussi célèbre que son décor et son service soigné). Si vous voulez marcher sur les traces de Coco Chanel rendez-vous rue de Cambon. La place du marché Saint-Honoré est superbement animée les soirs avec ses petites terrasses très sympa. 
En ce qui concerne l'insécurité soulignée par l'atrophiée du bulbe, elle existe surtout dans ses fantasmes. Certes, le forum des Halles, une partie de la rue Lescot, la rue Pierre Berger et la fontaine des innocents, la rue des Bourdonnais et la rue Saint-Denis gâchent un peu notre joie d'être dans un si bel arrondissement : cris, langage d'orang-outang, moeurs mal dégrossies... Mais la présence des CRS et de leurs fourgons stationnés rue Pierre berger, le commissariat, la présence de la BAC y est tellement importante qu'au moindre problème, tous ces agents débarquent rapidement. Mon amie qui est une femme s'y promène régulièrement la nuit et il ne lui est rien arrivée. Simplement faire attention aux voleurs discrets et qu'on trouve dans toutes les capitales.","Les points négatifs : Les points négatifs. Le côté lourdingue des banlieusards qui colonisent les Halles mais franchement rien de bien méchant. L'arrondissement ne brille pas non plus par sa qualité d'enseignement. Un seul collège public, collège Poquelin. Il était dirigé par un principal de front de Gauche qui faisait venir toute la population nord de la capitale. Une vraie zep à côté du Palais-Royal et en face du louvre et qui expliquait pourquoi les familles du 1er arrondissement n'y mettaient pas leur enfant. Depuis l'arrivée d'une nouvelle principale qui a décidé de redonner ses lettres de noblesse à l'établissement, les familles regagnent progressivement confiance même si ce n'est pas encore gagné. Attention à cette aberration le LEC Lescot rue des Bourdonnais : quand on passe devant et qu'on y voit les individus scolarisés c'est effrayant : je me demande comment la direction les recrute et surtout où ? Ils doivent en faire du chemin pour venir jusque dans le 1er arrondissement.
Attention à la politique démagogique des socialistes qui force le maire à construire des logements sociaux de plus en plus nombreux (un bel immeuble entier rue du Louvre =  56 logements sociaux / l'hôtel des Postes qui à son tour va abriter prochainement des logements sociaux ainsi que la Samaritaine = quelle honte quand tant d'étudiants parisiens et de classes moyennes qui travaillent sur la capitale n'arrivent pas à se loger : y mettre à la place des familles qui ne travaillent pas et qui ne parlent pas un mot de la langue de Molière ! Et quelle image on va donner aux touristes.
Au niveau des équipements sportifs, un  seul gymnase aux Halles. Pas top. mais par contre une grande piscine semi-privée, la piscine Suzanne Berlioux, très propre : les agents de vestiaire nettoient régulièrement et tout le monde doit quitter ses chaussures avant de pénétrer dans les vestiaires. Au coeur de Paris ça n'a pas de prix."
11,Avis posté le 02-05-2014 à 14:55,paris-1er-arrondissement_75101,ash,5.13,5,3,8,5,10,4,8,7,4,Les points positifs : Animé,"Les points négatifs : Insécurité, espaces verts"
12,Avis posté le 02-12-2021 à 22:05,paris-2e-arrondissement_75102,mellopu,8.63,6,9,6,9,9,9,10,10,7,"Les points positifs : Avec le nouveau parc des Halles,  la nouvelle poste de la rue du Louvre et le sublime musée Pinault à la Bourse de commerce,  le sud du 2e est métamorphosé. La rue Saint-Denis et le Nord se gentrifient aussi. Ambiance très très agréable,  avec population jeune (beaucoup de bureaux de start-up donc terrasses très animées) et- globalement - respectueuse.","Les points négatifs : Très inaccessible en voiture en venant du périph,  pas de grand bois ni de grands terrains de sport.
Les prix de l'immobilier grimpent et le nombre de familles diminue."
13,Avis posté le 19-12-2020 à 00:11,paris-2e-arrondissement_75102,Riri,7.69,6,8,6,7,9,8,9,9,5,"Les points positifs : Arrondissement hyper central, animé vivant, de nombreux restaurants bars hyper fun branchés comme traditionnels. On peut tout faire à pied et métro ligne 4 8 9 3.
Quand on se fait connaître par les commerçants et restaurateurs et qu'on est du quartier (plus qu'un simple touriste) on est tout de suite bien accueillie et on vit une bonne vie de quartier.
Beaucoup de musées, passages, le sentier qui bouge la rue saint Denis qui devient hype. Rue Montorgueuil incontournable. Rue des petits carreaux, bref plein d'endroits top et quartier ouvert au monde.","Les points négatifs : Comme tout centre ville : pollutions,  beaucoup de passages, peu d'espace vert."
14,Avis posté le 21-07-2020 à 10:16,paris-2e-arrondissement_75102,CS92250,3.94,5,7,1,5,8,3,7,5,1,"Les points positifs : Central et très bien desservi pas les transports en commun.

A part ça... plein de commerces pour touristes.","Les points négatifs : J'ai vécu 9 ans dans le 2ème arrondissement. J'ai déménagé à Alfortville en janvier et je ne regrette pas.

Je ne supportais plus le monde (infernal pour marcher sur les micros trottoirs), les voitures (embouteillages monstres), le béton (un seul espace vert de 10m2 dans le sentier près de Notre Dame de bonne nouvelle), le bruit (surtout des lieux pour touristes), la saleté (pas due à la mairie de Paris mais aux gens sales, parisiens et touristes, par exemple la pisse dans tous les coins de rues), la promiscuité dans les immeubles. J'ai vécu dans 35 m2, ce qui est correct pour le centre de Paris, mais dans l'ancien il faut tenir compte du fait que vous vivrez avec les voisins qui sont souvent dans ce quartier des touristes venus pour profiter. les immeubles sont donc très bruyants et si vous venez de province, comme beaucoup, il faudra vous y faire ou pas."
15,Avis posté le 06-05-2020 à 16:40,paris-2e-arrondissement_75102,Oliv94,5.88,6,7,4,7,9,5,9,10,2,"Les points positifs : J'étais content de m'y installer.
Au bout de 2 ans voici les points positifs du plus petit arrondissement de Paris.
Clairement ce sont les transports. Pas besoin de voiture, vous pourrez aisément vous déplacer grâce aux lignes de métros, bus et RER qui vous amèneront aux aéroports par exemple.
Autre point positif : les commerces et activités culturelles. Entre les petits commerces, les restaurants les grandes enseignes, les cinémas et autre vous serez conquis.
Une sécurité maîtrisée notamment dans l'ouest de l'arrondissement. La rue Saint Denis qui n'avait pas réputation glorieuse est désormais assez similaire à la rue Montorgueil, ce qui n'est pas négligeable.
Quelques pépites : les galeries méritent le détour, la rue Montmartre agréable tout comme les rues perpendiculaires à la rue Montorgueil.","Les points négatifs : Après 2 ans j'étais content de partir pour les raisons suivantes :
Trop de monde, trop de nuisances, trop pollué.
On a un sentiment d'étouffement, le manque crucial d'espace vert n'aide pas.
Aucun charme côté Sentier et la porte Saint Denis inspire le dégoût. 
Le prix des loyers et à l'achat est exorbitant.
Un arrondissement qui coûte cher pour au final un cadre de vie mitigé."
16,Avis posté le 29-10-2019 à 12:51,paris-2e-arrondissement_75102,Dudussse,5.50,6,4,8,8,8,5,8,4,2,"Les points positifs : Si vous aimez la vie urbaine et son activité vous serez servis. Un ""arrondissement-restaurant"" à ciel ouvert.
En terme de transport vous avez plusieurs lignes de métro : 8-9-3-4 et de RER : A, ainsi que de bus.
Arrondissement très culturel et vivant... Une cantine à l'école primaire très axée sur des produits biologiques.
Des clubs de sports à proximité.

En gros la proximité.....","Les points négatifs : Un maire Vert qui hormis un mur végétalisé et une cantine bio n'a rien fait de CONCRET dans cet arrondissement minéral.
J'y suis depuis que je suis né (43 ans), une grosse partie de la population de classe ouvrière ou employé de bureau qui a du partir face à l'inertie de la mairie de Paris ET de l'arrondissement.
Des habitants pas forcément sympas qui sont le porte-voix de l'entre-soi.
Des logements sociaux donnés aux ""copains"" et pas aux habitants historiques dans le besoin.
Des restaurants soi-disant gastronomiques qui font pour beaucoup (pas tous) du sous-vide pour des prix qui font couiner le lard-feuille.
Enfin, des loyers hors-sols qui ne sont pas du tout intéressants, pour des logements avec des surfaces biscornues... la blague."
17,Avis posté le 28-10-2019 à 11:17,paris-2e-arrondissement_75102,Rose,2.38,4,2,2,4,7,0,10,9,0,"Les points positifs : Central, animé, historique.","Les points négatifs : Quartier de passage. Les gens viennent au ciné, boire un verre ou acheter des vêtements et s'en vont. Les locaux (y en a peu) ne sont pas du tout sympathiques. Bruit constant matin soir, nuit. Saleté des rues étant donné le passage. Délinquance à maîtriser. Et surtout ce qui marque, c'est la pollution, abondante et intense. Ajoutez y le bruit est c'est la formule parfaite pour devenir dingue."
18,Avis posté le 16-09-2019 à 13:06,paris-2e-arrondissement_75102,Cedsen,5.19,8,8,2,8,10,4,8,5,2,Les points positifs : Central est à peu près le seul intérêt de cet arrondissement dans lequel je vis depuis 9 ans.,"Les points négatifs : Très dense, aucun espace vert, mis à part un square de 4m2 et quelques arbres sur les boulevards. Il est parfois dur de marcher sur les trottoirs tellement il y a de monde.

Une réelle invasion de touristes Airbnb depuis 2 ou 3 ans avec l'inconvénient que certains ne respectent rien, sont bruyants, et que tout le monde doit supporter ces personnes auxquelles on ne peut rien dire car ils sont là pour s'amuser.

Arrondissement, comme la plupart de Paris, très sale. Cela est dû aux encombrants sauvages sur les trottoirs, déchets divers, urine dès qu'il y a un coin tranquille.

Énormément de commerces mais très mal répartis. Par exemple, aucun commerce entre Strasbourg Saint-Denis et Réaumur et une overdose rue des Petits-Carreaux. De plus, une standardisation des commerces comme dans tout Paris.

Un immobilier hors de prix vu la qualité des immeubles. Il vaut mieux acheter du Haussmann dans un arrondissement comme le 18e qu'un appartement 1900 ouvrier dans le 2e dont on est pas certain qu'il tiendra aussi longtemps. Attention au Sentier également. C'est joli mais l'affaissement d'immeubles de la butte, qui n'a rien de naturel mais est un ancien dépôt de déchets, est fréquent."
19,Avis posté le 30-12-2018 à 23:03,paris-2e-arrondissement_75102,Reb,6.19,4,5,2,7,10,6,10,10,3,"Les points positifs : Commerces accessibles , transports à 3 minutes , emplacement idéal pour tout faire à pied , restaurants de tous les choix.","Les points négatifs : Prostituées, saleté, pas trop sécurisé avec toutes les racailles qui viennent passer des soirées dans le quartier.
Manque d'espace vert, de centre sportif comme piscine, mini foot ou même stade de basket."
20,Avis posté le 11-10-2018 à 18:03,paris-2e-arrondissement_75102,Ricath,8.38,8,8,9,10,10,8,10,10,5,"Les points positifs : Quartier très central, on est proche de tout : commerces, transports, cinémas, Louvre et Beaubourg, etc. Contrairement à certains commentaires, je ne trouve pas que la prostitution de la rue Saint-Denis soit gênante. D'ailleurs il y en a de moins en moins, et la rue Saint-Denis tend à ressembler à Montorgueuil.",Les points négatifs : Quasiment pas d'espaces verts (il faut dire que l'arrondissement est tout petit). Certaines parties sont bruyantes le soir en raison des nombreux cafés et restaurants.
21,Avis posté le 19-07-2018 à 01:11,paris-2e-arrondissement_75102,Noémie De V,2.06,1,1,4,5,2,1,7,5,0,Les points positifs : centre pompidou - montorgueil - commerces - restaurants quartier vivant.,"Les points négatifs : crasseux, saleté répugnante, hyper bruyant voir infernal du côté du Boulevard Sebastopol, de plus en plus mal fréquenté, racailles et dealers, bref invivable  comment vivre dans cette crasse et ce brouhaha perpétuel ?

Adresse email invalide !!"
22,Avis posté le 18-07-2018 à 00:49,paris-2e-arrondissement_75102,Mgt16,7.13,7,6,8,7,9,7,9,9,3,"Les points positifs : Montorgueil, Opéra, transports, clubs, nombreux restaus et commerces. Globalement je recommande ce quartier jeune et dynamique, parfait pour quelqu'un sortant beaucoup !","Les points négatifs : Squat, prostitution, pollution.
La prostitution rue st denis est vraiment insupportable et intolérable. 
De même, attention vers le métro Bonne Nouvelle où on peut rencontrer de nombreux toxicos."
23,Avis posté le 30-08-2017 à 23:55,paris-2e-arrondissement_75102,Lala,3.00,2,3,5,6,1,2,7,8,0,"Les points positifs : Montorgueil, Vivienne agréables, bars, cinéma Le Grand rex, restaurants.","Les points négatifs : Bruyant, le Boulevard Sébastopol est insupportable, hyper pollué, vous ne pouvez pas rester les fenêtres ouvertes si vous y vivez, le quartier est sale, très sale et selon les rues, très mal fréquenté."
24,Avis posté le 28-05-2017 à 09:22,paris-2e-arrondissement_75102,liloudeparls,9.06,10,10,10,8,9,9,8,8,10,"Les points positifs : rue montorgueil, central, transport, quartier vivienne,
la bourse. de nombreux et bons restaurant... le grand rex juste à cote... un quartier qui bouge avec la présence de plusieurs bars et boîtes de nuit. niveau culture le louvre et le centre georges Pompidou sont à 2 pas .","Les points négatifs : prostitution, le quartier commence à accueillir ses premières racailles rue saint spir - sur la place rue d'alexandrie. la saleté de certaines rues... les poubelles qui débordent en fin de journée... la fin de la rue d'aboukir toujours en travaux.
clairement le maire soigne la vitrine du quartier (montorgueil, vivienne) et délaisse la partie strasbourg saint denis sentier."
