,date,arrondissement,auteur,etoile,education,securite,loisir,sante,transport,qualite de vie,culture,commerce,environnement,commentairePositif,commentaireNegatif
300,Avis posté le 10-12-2020 à 10:13,paris-13e-arrondissement_75113,Annie Cordy,9.44,9,9,9,9,9,10,9,9,8,"Les points positifs : Ca fait seulement 3 ans que j'habite sur l'avenue de Choisy et je suis très rapidement tombé amoureux de cet arrondissement à l'ambiance si unique.

Chaque quartier de l'arrondissement dégage une sensation particulière que l'on ne retrouve nulle part ailleurs. Le quartier de la Maison Blanche et de la Poterne des Peupliers, reste pour moi un immense coup de coeur. Et puis, l'immense quartier populaire surnommé ""de La Gare"" garde encore et toujours le même statut de quartier ouvrier, comme il l'était au XIXème siècle. Le quartier Jeanne-d'Arc/Nationale/Dunois par exemple, notamment en jour de marché, garde encore une atmosphère de village modeste en plein dans la métropole que je n'ai pour l'heure retrouvé nulle part ailleurs.

Et que dire de l'immense quartier chinois, si important dans mon coeur ? Je pourrai passer des heures à arpenter l'avenue de Choisy ou l'avenue d'Ivry. Et puis la dalle des Olympiades, contrairement à ce que les médias essaient de faire croire, est un lieu extrêmement calme où il fait bon vivre, qui dégage une ambiance de cité comme il en reste très peu en France. Et entre le très beau parc de Choisy, le parc Kellerman, le Square René le Gall (et 15 autres et jardins et squares!) en terme d'espaces verts, rien à dire aussi !

Ce n'est peut-être pas le plus bel arrondissement de Paris, mais il restera à jamais mon préféré !",Les points négatifs : Les portes d'Italie et d'Ivry ne sont pas très belles.
301,Avis posté le 13-10-2020 à 18:33,paris-13e-arrondissement_75113,206Merguez,3.94,6,2,7,7,4,3,2,9,2,"Les points positifs : Points de commerces et restaurants nombreux, Italie 2 et Géant Massena.
Quartier bien desservi grâce au métro, bus et tram.","Les points négatifs : - Prix de l'immobilier indécent
- Très sale: pisse, caca, déchets, surveillez vos pieds
- Nuisances sonores: travaux partout, klaxons
- Augmentation de l'insécurité et incivilités

- Mixité sociale qui coule le quartier, par une certaine population que vous devinerez. Vers la cité des carrés, tous les jours, il y a des rodéos en scooter, ça braille fort, que ce soit de jour ou de nuit.
Vers porte d'Italie, le square Samuel-Beckett est d'une tristesse sans nom.
Le jardin Juan Miro juste à coté, est constamment squatté par les racailles du lycée professionnel Gaston Bachelard, en train de beugler, dompter les chevaux/balançoires pour enfants.

- SDF partout, les roms laveurs de pare brise devant le périphérique de porte d'Italie.

- Circulation routière de pire en pire dû l'apparition des pistes cyclables, et la suppression des places de stationnements. Les pistes cyclables sont inutiles car les cyclistes ne les utilisent même pas. Ils sont soit sur le trottoir, ou soit en train de pédaler sur la voie des voitures, on croirait assister au Tour de France, un peloton complet. Les trottinettes électriques idem, sur les trottoirs à slalomer entre les personnes ou soit sur la voie des voitures avec leurs congénères cyclistes.

- Métro ligne 7 plombé par les pannes, et beaucoup trop de monde. On paye un abonnement navigo et le service fonctionne même pas. Idem pour les bus et tram T3a, saturation. On nous dit de ne pas utiliser la voiture, mais d'utiliser les transports en commun, sauf qu'aucun effort est fait de ce côté là... Le métro parisien est immonde, pue. Certains disent que ça fait le charme de Paris. Je n'ai pas envie pas d'avoir un Gange parisien merci.

- La fac de Tolbiac est à oublier (grève/blocus 24h/24, propagandes etc.. insupportable)

- La Poste à porte d'Italie, est une torture, prévoyez 30 mins au moins si vous venez retirer un colis ou faire des opérations bancaires, car les clients habituels là-bas ne comprennent même pas le français, se plaignent et engendrent une file d'attente monstre pour rien.
- Communauté asiatique qui se vide
- Restaurants asiatiques remplacés par des restaurants français bobos au prix
scandaleux
- Les gens tirent la gueule car stressés par cette ville devenue anxiogène."
302,Avis posté le 15-09-2020 à 22:58,paris-13e-arrondissement_75113,Lucette77,6.13,7,5,7,9,10,5,8,7,5,"Les points positifs : Bibliothèque nationale, bord de Seine, transport (bus, métro 14 et 6, rer), très bonne école primaire Jeanne d'Arc (la rouge), place Jeanne d'Arc sympa pour les petits commerces indépendants et son esprit village, Tang frère à une station de métro (olympiade), piste cyclable jusqu'à Vincennes, commerçants sympathiques.","Les points négatifs : Pas très propre, beaucoup de mendiants et certains très intrusifs. Fumeurs de crack et deal sous le pont de Tolbiac, collège Thomas Mann à éviter malgré son directeur qui essaye désespérément de relever la barre, cambriolages par épisode (mais ça je crois que c'est partout)."
303,Avis posté le 07-09-2020 à 00:57,paris-13e-arrondissement_75113,Spika,3.06,3,2,3,7,3,3,3,3,1,Les points positifs : La Proximité des cinémas et de l'hôpital pitié salpêtrière.,"Les points négatifs : Saleté, Saleté, incivilité beaucoup de sdf, parfois agressifs en état d'ivresse. Les rues ne sont pas ou peu nettoyées. Je ne me sens pas en sécurité le soir quand je rentre chez-moi. Beaucoup de nuisances sonores.
Beaucoup de zonards, de clandestins, peu de police dans les rues notamment rue de Tolbiac."
304,Avis posté le 30-08-2020 à 08:18,paris-13e-arrondissement_75113,Flowerpower,6.06,8,2,7,8,8,6,7,7,2,"Les points positifs : Quartier corvisart gobelin : tout à portée de main, très bon aménagement de pistes cyclables, mixité sociale réussie, assez central et accès aux parcs et jardins plutôt facile. Quartier facile à vivre, en journée.",Les points négatifs : La circulation est tout simplement cauchemardesque. De nombreux marginaux parfois agressifs et un commissariat qui ne répond pas. Très insécurisé le soir : 2 agressions en 3 ans - bvd Blanqui et rue Pascal !
305,Avis posté le 19-08-2020 à 03:01,paris-13e-arrondissement_75113,JojoL'Asticot,6.38,9,7,7,8,10,6,7,6,0,"Les points positifs : Tout est très bien desservi : bus vers la Sorbonne Panthéon (20min), tram vers Cité universitaire (15min), métro vers centre de Paris (10-15min), vers la gare de Lyon (5min) ou vers gare Montparnasse (15min). Rien à redire de ce côté-là, car idéalement placé.

Quartier et population asiatique agréables.

Universités assez proches, dont INALCO; centre commercial à Italie 2; côté bibliothèque très jeune et branché. Forte présence de communautés africaines diverses qui vivent comme au bled, mais ils ne sont pas bien méchants.

Présence de docteurs, de labos d'analyses, de dentistes, psys, etc.

Il y a un peu de racailles, comme partout, mais quand on vient du sud on se rend compte que les parisiens sont des enfants de chœur à ce niveau là (bien que plus nombreux).

J'ai fini par me sentir chez moi dans le 13ème arr malgré certains points négatifs non négligeables.","Les points négatifs : - Moche
- Très sale : pisse, vomi, déjections d'animaux, déchets divers...; il faut donc regarder où on met les pieds car le terrain est bien miné.
- Tout est cher (on est à Paris, quoi)
- Ça manque de grands supermarchés du type de ceux qu'on trouve dans les ZA des petites agglomérations, ce qui nous pousse à aller dans les commerces de proximité où on va forcément beaucoup plus casquer.
- Trop de clodos (ils ne sont pas méchants, mais sont assez relous)
- Zéro espaces verts (pour un sudiste comme moi, difficile à vivre)
- Avenue de France pas du tout esthétique, j'ai les yeux qui saignent dès que je passe par là."
306,Avis posté le 11-08-2020 à 14:11,paris-13e-arrondissement_75113,Portbou,7.19,7,6,6,8,7,8,5,8,4,"Les points positifs : Contexte: quartier Glacière-Tolbiac.
Mon quartier est globalement agréable, avec beaucoup de commerces de bouche traditionnels, ce qui n'est pas le cas dans tout l'arrondissement. Le marché du bd Blanqui est de qualité. On trouve facilement du très bon pain.
Le bâti est hétérogène, ce n'est pas un quartier patrimonial, mais il y a quelques beaux hausmanniens, et les résidences des années 60, bien qu'assez moches, ont souvent des espaces verts.
Mes enfants ont fait leur scolarité entièrement dans le public sans souci particulier (mais il faut choisir avec soin les options au collège pour échapper à des classes bas de gamme). Enseignants inégaux, comme partout.
Pour la culture: il pourrait y avoir plus de choses. Le théâtre 13 ne suffit pas. Le maire met en valeur le ""street art"". Qui cela intéresse-t-il?","Les points négatifs : Au fil des années, j'ai vu augmenter les incivilités. Pas au point de se sentir en insécurité, mais un peu usant au quotidien.
Beaucoup trop de pétards cette année avant et après le 14 juillet.
Les trottoirs sont souvent très sales. Beaucoup de dépôts d'encombrants ""sauvages""."
307,Avis posté le 06-08-2020 à 10:53,paris-13e-arrondissement_75113,dydy13,7.44,8,6,9,6,10,7,9,9,6,"Les points positifs : Commentaire qui vaut pour le sud du 13ème (Porte Ivry, Choisy)

Cela fait désormais 13 ans que je vis dans une des tours de porte d'Ivry. Si je suis encore là c'est que je m'y plais, malgré pas mal de points négatifs.

- Géant Casino : le seul hypermarché de Paris est ici
- Transports : T3, Métro7, 14, arrivée du tramway T9
- Proximité avec le sud de Paris et accès au périphérique
- Commerces nombreux
- Restaurants
- Nombreuses écoles.","Les points négatifs : - Les prostituées le long de l'avenue d'Ivry
- Le marché sauvage les étés précédents
- La propreté (excréments, poubelles, odeur..)
- Nuisances sonores."
308,Avis posté le 14-07-2020 à 08:05,paris-13e-arrondissement_75113,zorglub,4.06,5,1,4,7,8,3,7,9,0,"Les points positifs : Métro, tramway, ligne 14 ( bientôt jusque Maison Blanche )
Géant casino, les restaurants Asiatiques
Les Asiatiques ( qui malheureusement sont de plus en plus nombreux à quitter ce quartier ).","Les points négatifs : Quartier Porte de Choisy : odeurs d'urine, papiers, emballages jetés à même le sol
 Trotinettes, scooters sur les trottoirs ( en toute impunité )
""Incivilités "" par une part de la population qui remplace les Asiatiques
Pollution sonore aliénante : hurlements de bêtes ou d'animaux ?
Bref, le quartier s'est énormément dégradé en quelques années..."
309,Avis posté le 11-07-2020 à 08:56,paris-13e-arrondissement_75113,Cabano Kid,7.75,7,9,4,7,7,9,6,7,5,"Les points positifs : Quartier Glacière-Arago. Tranquille, petits commerces de proximité suffisants, quelques espaces verts.
Plutôt résidentiel.
Transports pratiques : Bus 21, 59, 83, voire 91. Métro Glacière, ligne 6, ou Gobelins, ligne 7.
Pas de problème pour la scolarité.
Nombreux hôpitaux ! (Cochin, Ste Anne, La Salpétrière, etc.)
Voirie généralement bien nettoyée.","Les points négatifs : Commerces alimentaires de la rue Mouffetard et Daguerre éloignés et ""moyennes surfaces"" également (Carrefour, Monoprix). Commerce de bricolage (à prix abordable) trop éloigné. Animation de quartier très réduite. Quartier un peu ""mort"" (inconvénient de la tranquillité)."
310,Avis posté le 05-02-2022 à 04:48,paris-14e-arrondissement_75114,francheval,8.81,7,8,7,10,10,9,10,9,8,"Les points positifs : Arrondissement sympathique,  aéré et très sûr pour la moyenne Parisienne,  avec un riche patrimoine culturel.

Nombreux anciens ateliers d'artistes dans le quartier Montparnasse,  et villas Bauhaus ou Art Nouveau cachées dans des impasses autour du parc Montsouris. Attractions insolites comme les Catacombes,  l'Observatoire,  la Fondation Cartier et la Cité Universitaire. Plein de tombes célèbres au cimetière du Montparnasse situé au pied de la tour. Coulée verte autour de la Petite Ceinture.

Encore plusieurs cinémas autour du boulevard Montparnasse,  théâtres rue de la Gaité et boulevard Edgar Quinet,  librairies,  commerces et restaurants nombreux et variés avec notamment la fameuse rue Daguerre. Population plutôt intello,  très marquée ""rive gauche"". Relative proximité du Quartier Latin,  du jardin du Luxembourg et du quartier chinois du 13ème.

Plein de médecins,  de labos et dispensaires,  et plusieurs hôpitaux. Transports publics au top,  avec les lignes 4,  6 13,  et le RER B. Outre la gare Montparnasse,  l'accès aux deux aéroports est direct par RER ou bus. Centre commercial Gaité avec Darty,  et Fnac rue de Rennes facilement accessible.","Les points négatifs : Immeubles géants et spectaculairement laids aux abords de la gare Montparnasse. La rue Vercingétorix située le long des rails est déprimante et mal fréquentée,  ainsi que la Porte de Vanves.

A l'est,  présence de la prison de la Santé et de l'hôpital psychiatrique Sainte Anne. D'où un calme inhabituel et appréciable,  mais une atmosphère un peu étrange le soir et la nuit.

Immobilier très cher au nord et autour du parc Montsouris. Comme partout à Paris,  trafic,  pollution. Depuis plusieurs années,  SDF et rats place Denfert Rochereau."
311,Avis posté le 31-01-2022 à 15:11,paris-14e-arrondissement_75114,JeromeParisRavel,9.06,10,8,9,10,10,9,8,9,9,"Les points positifs : J'habite dans le 14e vers la place Denfert-Rochereau. Ce que j'apprécie ce sont les commerces nombreux et variés,  les espaces verts (parc Montsouris,  parc de l'Observatoire par exemple),  les transports (métro,  RER,  Orly BUS). C'est un arrondissement où on se sent encore en sécurité,  du moins dans la partie où j'habite. L'hypercentre n'est pas très loin (15 mn à pied),  et on est  à proximité des meilleurs lycées (Lavoisier,  Louis le Grand,  Henri IV).","Les points négatifs : Seul point négatif,  le prix des appartements,  et les difficultés de circulation en voiture !"
312,Avis posté le 18-11-2021 à 19:30,paris-14e-arrondissement_75114,Woody75,7.63,8,10,8,10,6,8,4,6,6,"Les points positifs : Habitant dans le quartier de Pernety,  j'attribuerais une note supérieure à pas mal de coins de l'Est et du Nord parisien (j'ai longtemps vécu à Montmartre et dans le centre,  côté 10ème).

Le quartier est plutôt mignon : la rue Raymond Losserand,  la rue des Thermopyles,  c'est joli et varié.

Je ne sors quasiment pas dans le reste de l'arrondissement car il n'y a rien à y faire. Heureusement,  la 13 est rapide et les grandes places de la rive droite sont à moins d'une demi-heure (les trajets ne sont pas plus longs qu'en habitant là-bas).","Les points négatifs : Beaucoup critiquent la gentrification,  les petits restos originaux qui vont avec,  les boutiques et galeries d'art.

Je trouve que c'est ce qui manque dans le sud Paris. Le quartier a été flamboyant dans les années 70,  les artistes s'y concentraient massivement. Aujourd'hui il n'en reste que la mémoire.

Mais les appartements étant plus accessibles que dans le reste de la capitale (et parfois même plus qualitatifs),  il se pourrait que ça change,  et tant mieux."
313,Avis posté le 13-11-2021 à 12:19,paris-14e-arrondissement_75114,Corbat,4.75,7,5,7,7,9,3,7,7,3,"Les points positifs : Le commentaire précédent résume parfaitement bien la situation : un arrondissement coupé maintenant en 2.
Une zone nord encore "" chic"" et une zone sud qui part totalement à vau l'eau (islamisation galopante,  nuisances sonores épouvantables..)

Et une mairie aux abonnés absents qui se fout totalement de l'avis de ses administrés.","Les points négatifs : J'ai fui cet arrondissement( j étais dans la zone "" délabrée"" autrefois si agréable..) pour la proche banlieue depuis maintenant quelques mois et je ne regrette vraiment pas mon choix.
Encore quelques années à ce rythme et Paris va se transformer en véritable cloaque et ne croyez pas que la marée va miraculeusement s'arrêter aux arrondissements périphériques 😢 .
"
314,Avis posté le 02-11-2021 à 12:40,paris-14e-arrondissement_75114,Michel,8.75,8,10,8,8,8,9,8,9,9,"Les points positifs : Mes voisins m'ont montré ce site,  le classement des villes dans la notation. J'ai donc appris,  grâce à ce site,  qu'Aulnay-sous-Bois,  Que Paris 19ème,  Que Paris 20ème et j'en passe,  sont bien mieux notés que Paris 14ème... bon,  d'un côté tant mieux,  si ça peut effrayer quelques bobos,  et qu'on reste encore préservé de la ville musée c'est une bonne chose !

 Sinon,  je me demande où est l'objectivité de toutes ces notations,  à croire que,  comme dit dans les quelques commentaires précédents,  le 14eme ne se résume qu'au Bd brune,  et aux cités ZUP de Vanves etc etc.  Pourquoi le 15eme arrt voisin est presque à 8/10 de moyenne,  alors que lui aussi comporte des zones sensibles (Balard, Périchaux,  Falguière) ? C'est le cas de tous les arrondissements excentrés qui bordent le périphérique malheureusement.
Mais une note si basse,  plus basse que le 19ème et Aulnay sous bois,  pour cet arrondissement que j'ai toujours habité,  ça me fait quand même mal au coeur,  on ne peut pas le résumer qu'aux portes !
Venez faire un tour à Montparnasse,  à Raspail,  à l'observatoire pour flâner ou bien à Gaîté ou Daguerre pour les commerces. Vous verrez... on est loin du marché d'Aulnay sous bois !

Quand je raconte qu'ici,  mes voisins me disent bonjour quand je les aperçois Rue Daguerre,  que mes commerçants me connaissent bien,  on me croit à peine... et pourtant,  c'est aussi ça le 14ème,  un village d'habitués !
Il y a également une forte vie associative ce qui permet de faire aisément des rencontres: cela nous fait presque oublier qu'on est dans la ville la plus dense au monde !","Les points négatifs : -Il faut bien avouer que selon les quartiers,  ce n'est pas pareil. Pour ma part,  je me range du côté de la majorité car je n'aime pas le quartier qui longe les rails,  ça a été urbanisé trop vite,  trop mal,  mais des efforts sont faits pour le rénover... Mais je connais quand même des personnes qui préfèrent ce quartier et qui s'y sentent plus à l'aise,  il y'a une forte vie associative vers Pernety,  des magasins de proximité... chacun ses goûts,  mais moi,  je n'aime pas.

-La mairie est inefficace,  Madame la Maire n'est pas disponible pour les habitants du 14 et ne répond pas à leurs questions. On ne veut pas réinventer Paris nous,  on veut l'améliorer et l'entretenir !

-Certains élus du 14 vantent les effets de la mixité sociale aux portes,  alors qu'ils habitent à Vavin. Mesdames,  messieurs,  écoutez vos citoyens qui sont les premiers concernés dans ces quartiers oubliés ! Et ne reproduisez pas dans les endroits épargnés vos volontés politiques médiocres pour faire du chiffre."
315,Avis posté le 30-10-2021 à 02:20,paris-14e-arrondissement_75114,Le 14eme,8.88,8,9,8,9,10,9,8,9,9,"Les points positifs : Le 14ème c'est grand et donc très disparate d'un endroit à un autre (comme le 13è,  15è,  17è...)
Il y'a certes des problèmes,  qui sont présents depuis des années,  notamment vers les maréchaux proche du périphérique (en même temps,  qui souhaitent habiter ici ?). Mais Quand je vois certains commentaires et notes (4 de moyenne pour l'environnement ? Et 5 pour la sécurité dans le 14eme ?) je me demande si on vit au même endroit,  ou si les notations viennent tous des habitants du sud ouest de l'arrondissement (Porte de Vanves par ex). .. Je vais donc noter mon quartier que je connais très bien pour y être depuis pas mal d'années,  et qui représente une bonne partie du 14è où il fait bon vivre,  entre Montparnasse et St-Jacques et de Denfert vers Montsouris.

SÉCURITÉ : J'ai vécu dans le 16ème Nord quelques années,  et je peux vous dire que je me sens limite mieux ici en terme de sécurité. Déjà,  il y a toujours du monde (beaucoup de transit à Denfert et Montparnasse) et Il n'y a pas de bandes de jeunes dans le nord du 14è qui viennent faire je ne sais quoi comme on peut le voir au Trocadéro ou sur la place de l'étoile en journée ou le soir. On semble tous attachés à la qualité de vie qu'on a du côté de Montparnasse/Quinet - Daguerre,  regardez autour de vous,  de jour comme de nuit,  on a pas l'air d'être terrifiés... alors 5 en sécurité,  c'est vraiment exagéré,  en tout cas pour le nord du 14. Si c'était Stalingrad ou Barbès,  le prix au M2 ne frôlerait pas les 14K-15K pour des biens vers Denfert et Montparnasse.

TRANSPORT: il y a tout,  métro,  bus,  trains,  gare Montparnasse,  gare RER à Denfert,  tram au sud. .. quoi de plus ?

ENVIRONNEMENT: oui,  beaucoup de circulation car périphérique à proximité. Mais,  ça reste un arrondissement très vert au nord: Cimetière,  Montsouris,  Cité U,  Serment de K,  Et de nombreuses allées vertes,  je m'y sens bien personnellement,  je respire comparé au centre de Paris.

COMMERCES: j'ai rarement vu autant de nourriture et de magasins au m2. Marchés à mouton-D.,  Edgar-Q,  Daguerre,  l'avenue du Général Leclerc,  Alésia... pour ne pas trouver son bonheur,  faut le faire ! Seul hic,  ça s'est vachement boboïser ces dernières années,  j'ai vu la différence,  et donc,  les prix.. mais bon,  c'est ça Paris aujourd'hui !

SANTÉ: Port royal, Cochin,  Ste Anne,  Necker à 5min...","Les points négatifs : Effectivement,  le 14e ne se résume pas qu'à Montparnasse/Denfert... on le remarque très vite d'une rue à l'autre en passant l'avenue du Maine. Ca reste «vivable» à certains endroits en journée si on y passe juste (Pernety,  Plaisance) même si c'est plus « populaire » disons,  mais le soir,  ça peut faire glauque car moins animé que Montparnasse.. Porte de Vanves rencontre les soucis que toutes les cités rencontrent ces derniers temps dans Paris et ailleurs,  c'est bien dommage... (police ?)

D'où la nécessité de maîtriser le parc HLM,  attribuer aux gens qui font vivre Paris et respectueux... y'en a à Vavin et Denfert,  et ça marche très bien,  pas de délinquance (faut que ça dure).

Adresse email invalide !!"
316,Avis posté le 17-10-2021 à 16:45,paris-14e-arrondissement_75114,darpa,4.19,7,1,2,6,8,4,1,7,3,"Les points positifs : les transports, les commerces.","Les points négatifs : depuis 15 ans c'est devenu une ville poubelle et mal fréquentée, aucun restaurant hormis des kebabs, de la racaille partout.
dangereux la nuit, trafic de drogue et le bruit du périph est insupportable, on nage dans la pollution et la crasse etc... à fuir de toute urgence."
317,Avis posté le 14-10-2021 à 23:53,paris-14e-arrondissement_75114,G75014,7.81,7,7,8,8,8,8,7,8,8,"Les points positifs : Les transports en commun,  nouvelles lignes de bus,  automatisation ligne 4,  nombreuses pistes cyclables
Les commerces de bouche et les autres
Le parc Montsouris
Le calme vers st jacques et glacière
De larges axes pour les piétons et une densité plus faible en moyenne vers saint Jacques (appréciable pendant le covid).","Les points négatifs : Le quartier plaisance près de la voie ferrée : moche et dangereux
La mairie privilégie pourtant ce quartier pour les embellissements."
